Perusahaan,Sektor
PT Sugabites Pastryndo,Food & Beverage / Catering / Restaurant
PT Sugar Labinta,Consumer Products/FMCG
pt sugaring bali,Grooming/Beauty/Fitness
PT Sugawa Indonesia,General & Wholesale Trading
PT Sugi Internasional Valas,Banking / Financial Services
PT Sugi Karya Abadi (Sukaba),Human Resources Management/Consulting
PT Sugico,Consulting (Business & Management)
PT Sugico Graha,Oil / Gas / Petroleum
PT Sugih Arto Sampurno,General & Wholesale Trading
PT Sugih Berkat,Construction / Building / Engineering
PT Sugih Indah Indoplast,Manufacturing / Production
PT Sugih Makmur Eka Industri Indonesia (SAN-EI),Environment / Health / Safety
PT Sugih Mukti Abadi,Electrical & Electronics
PT Sugih Perdana Wisesa (Palembang),Automobile / Automotive Ancillary / Vehicle
PT Sugiharto Sembada Klaten,Food & Beverage / Catering / Restaurant
PT Sugiron Citra,Banking/Financial Services
PT Sugiron Citra Lube,Manufacturing/Production
PT Sugison Senada,Polymer / Plastic / Rubber / Tyres
PT Sugity Creatives,Manufacturing / Production
PT Sugiura Indonesia,Automobile/Automotive Ancillary/Vehicle
PT Sugiyama Indonesia,Manufacturing/Production
PT Suharli Malaya,Manufacturing / Production
PT Suhartono Inti Prakarsa,General & Wholesale Trading
PT Suitmedia Kreasi Indonesia,Advertising/Marketing/Promotion/PR
PT Sujosi Multi Usaha,Consulting (Business & Management)
PT Suka Jaya Makmur Pratama,Advertising / Marketing / Promotion / PR
PT Suka Murah Dan Laris,Oil / Gas / Petroleum
PT Suka Sari Mitra Mandiri,Food & Beverage/Catering/Restaurant
PT Sukabumi Serasi Indah,Consumer Products / FMCG
PT Sukabumi Silika Resources,Mining
PT Sukabumi Taman Sari,Hotel / Hospitality
PT Sukabumi Trading Coy,Chemical/Fertilizers/Pesticides
PT Sukacita Mega Bisnis,Accounting/Audit/Tax Services
PT Sukamilk Sukses Indonesia,Food & Beverage/Catering/Restaurant
PT Sukanda Djaya,Manufacturing/Production
PT Sukanda Djaya,Consumer Products/FMCG
PT Sukanda Djaya (Bali),Transportation / Logistics
PT Sukanda Djaya (Banjarmasin),Banking / Financial Services
PT Sukanda Djaya (Batam),General & Wholesale Trading
PT SUKANDA DJAYA (Surabaya Experienced Candidates),Consumer Products / FMCG
PT Sukanda Djaya Cabang Makassar,Consumer Products/FMCG
PT Sukanda Djaya Cabang Pekanbaru,Manufacturing / Production
PT Sukapraja Estetika Padang Golf,Sports
PT Sukhawati Loka Funeral,Others
PT Suki Panca Jaya,Hotel/Hospitality
PT Sukma Anugerah Seroja,Construction / Building / Engineering
PT Sukowati Citra Medika,Hotel/Hospitality
PT Sukses & Naik Terus (Suddenly Travel),Travel / Tourism
PT Sukses Abadi Farmindo,BioTechnology/Pharmaceutical/Clinical research
PT Sukses Abadi Indo,Consulting (Business & Management)
PT Sukses Abadi Mitra,Food & Beverage/Catering/Restaurant
PT Sukses Abadi Sentosa Indonesia,General & Wholesale Trading
PT Sukses Akademi Indonesia,Consumer Products/FMCG
PT Sukses Anugrah Sejahtera,Human Resources Management/Consulting
PT Sukses Artha Mulya,Transportation / Logistics
PT Sukses Baja Semesta,Construction / Building / Engineering
PT Sukses Bersama Action Coach,Consulting (Business & Management)
PT Sukses Bersama Investama,Property / Real Estate
,
PT Sukses Bersama Nusantara,Construction / Building / Engineering
PT Sukses Bina Makmur,Manufacturing/Production
PT Sukses Cahaya Buana,"Consulting (IT, Science, Engineering & Technical)"
PT Sukses Cipta Griya Lestari,Property / Real Estate
PT Sukses Era Abadi,Retail/Merchandise
PT Sukses Era Niaga,General & Wholesale Trading
PT Sukses Gemilang Diamond,Heavy Industrial/Machinery/Equipment
PT SUKSES GEMILANG ENGINEERING,Construction/Building/Engineering
PT Sukses Global Pratama,Manufacturing / Production
PT Sukses Graha Samudera,Marine / Aquaculture
PT Sukses Indo Multiguna,Property/Real Estate
PT Sukses Integritas Perkasa,Computer/Information Technology (Software)
PT Sukses Inti Perkasa,Telecommunication
PT Sukses Inti Solusindo,Heavy Industrial/Machinery/Equipment
PT Sukses Jaya Abadi Tehnikatama,General & Wholesale Trading
PT Sukses Jaya Alkesindo,Others
PT Sukses Jaya Oel,Oil / Gas / Petroleum
PT Sukses Jaya Perkasa,Manufacturing / Production
PT Sukses Karya Abadi,Construction/Building/Engineering
PT Sukses Karya Perdana,Retail / Merchandise
PT Sukses Karya Yakin,General & Wholesale Trading
PT Sukses Kelola Persada,Property/Real Estate
PT Sukses Kencana Abadi,Mining
PT Sukses Komputindo Abadi,Accounting/Audit/Tax Services
PT Sukses Langgeng Abadi,General & Wholesale Trading
PT Sukses Lautan Indonesia,Manufacturing/Production
PT Sukses Makmur Perkasa,Automobile / Automotive Ancillary / Vehicle
PT Sukses Mandiri Gemilang,Consulting (Business & Management)
PT Sukses Mandiri Jaya,Electrical & Electronics
PT Sukses Mantap Sejahtera,Manufacturing/Production
PT Sukses Mentari Timur,Electrical & Electronics
PT Sukses Metal Sentosa,General & Wholesale Trading
PT Sukses Multi Performa,Human Resources Management/Consulting
PT Sukses Osean Khatulistiwa Line,Consumer Products / FMCG
PT Sukses Pangan Abadi,Consumer Products / FMCG
PT Sukses Pangan Abadi (Head Office),Food & Beverage/Catering/Restaurant
PT Sukses Perdana Indonesia,Food & Beverage/Catering/Restaurant
PT Sukses Perkasa Forestama,General & Wholesale Trading
PT Sukses Pratama Jaya,Retail/Merchandise
PT Sukses Runway Indonesia,Education
PT Sukses Sakti Sejati,Agricultural / Plantation / Poultry / Fisheries
