Perusahaan,Sektor
PT Sun Motor Jakarta,Automobile/Automotive Ancillary/Vehicle
PT Sun Paint Indonesia,Accounting/Audit/Tax Services
PT Sun Power Ceramics,Manufacturing/Production
PT Sun Precision Engineering Indonesia,Construction/Building/Engineering
PT Sun Sifa Nipponindo,Repair & Maintenance Services
PT Sun Star Motor,Automobile/Automotive Ancillary/Vehicle
PT Sun Star Motor (Badung),Automobile/Automotive Ancillary/Vehicle
PT Sun Star Motor (Blitar),Automobile/Automotive Ancillary/Vehicle
PT Sun Star Motor (Malang),Automobile/Automotive Ancillary/Vehicle
PT Sun Star Motor (Probolinggo),Automobile/Automotive Ancillary/Vehicle
PT Sun Star Motor (Sidoarjo),Automobile/Automotive Ancillary/Vehicle
PT Sun Star Motor Banyumanik Semarang,Automobile / Automotive Ancillary / Vehicle
PT Sun Star Motor Semarang,Automobile/Automotive Ancillary/Vehicle
PT Sun Star Motor Singaraja,Automobile/Automotive Ancillary/Vehicle
PT Sun Star Motor Surabaya,Automobile/Automotive Ancillary/Vehicle
PT SUN STAR PRIMA MOTOR,Automobile / Automotive Ancillary / Vehicle
PT Sun Starindo Wirahusada,Accounting/Audit/Tax Services
PT Sun Tak Indonesia,Textiles/Garment
PT Sun Technology Internusa,Manufacturing / Production
PT Sun Televisi Network,Entertainment/Media
PT Sunan Heritage Development,Property / Real Estate
PT Sunancon Makmur Perkasa,Retail/Merchandise
PT Sunari Bali,Travel / Tourism
PT Sunchina Ironmesh Machinery,Electrical & Electronics
PT Sunchirin Industries Indonesia,Automobile/Automotive Ancillary/Vehicle
PT Sunco Chemicals Indonesia,Chemical/Fertilizers/Pesticides
PT Sundari Day Spa,Grooming / Beauty / Fitness
PT Sundari Sukses Abadi,Hotel / Hospitality
PT SUNDISH TRAVEL INDAH,Travel / Tourism
PT Sunemas Perkasa,Construction/Building/Engineering
PT Sunflower International,Accounting/Audit/Tax Services
PT Sunfox,Retail / Merchandise
PT Sung Bo Jaya,Accounting / Audit / Tax Services
PT Sung Chang Indonesia,Manufacturing / Production
PT Sung Chang Indonesia Cabang Purbalingga,Manufacturing / Production
PT Sung Dak Indonesia,Textiles/Garment
PT Sung Hyun Indonesia,Manufacturing / Production
PT Sung Joo Mitra Global,Accounting/Audit/Tax Services
PT Sung Shim International,Grooming / Beauty / Fitness
PT Sung Shin Indonesia,Manufacturing/Production
PT Sung Wang Development,Construction/Building/Engineering
PT Sungai Berkah,Computer / Information Technology (Hardware)
PT Sungai Budi,Manufacturing/Production
PT Sungai Budi (Yogyakarta),General & Wholesale Trading
PT Sungai Budi Group Cirebon,General & Wholesale Trading
PT Sungai Budi Makassar,Transportation/Logistics
PT Sungai Mahakam ( Samarinda),Property / Real Estate
PT Sungai Melati,General & Wholesale Trading
PT Sungai Raya Nickel Alloy Indonesia,Manufacturing/Production
PT Sunggal Inti Makmur,Manufacturing/Production
PT Sunggong Logistics,Transportation/Logistics
PT Sunghyun Hightech Indonesia,Oil / Gas / Petroleum
PT Sungilindo Jaya Makmur,Polymer/Plastic/Rubber/Tyres
PT Sunglim Printing Indonesia,Accounting/Audit/Tax Services
PT SUNGRAFIKA SUKSES MAKMUR,Retail/Merchandise
PT Sungsan Global,Agricultural/Plantation/Poultry/Fisheries
PT Sunicodata Cominindo Ltd,Computer/Information Technology (Software)
PT Sunindo Adipersada,Manufacturing/Production
PT Sunindo Bangun Kersana,Manufacturing/Production
PT Sunindo Gapura Prima (Solo paragon),General & Wholesale Trading
PT Sunindo Parama Finance (Sun Motor Group),Banking/Financial Services
PT Sunindo Pratama,Oil/Gas/Petroleum
PT SunJaya Coating Perdana,Manufacturing/Production
PT Sunjin HJ,Manufacturing/Production
PT Sunlight Information Technology,"Consulting (IT, Science, Engineering & Technical)"
PT Sunlot Indonesia,Manufacturing/Production
PT Sunmotor Indosentra Trada-Suzuki Semarang,Automobile / Automotive Ancillary / Vehicle
PT Sunngai Industry,Manufacturing/Production
PT Sunny Mould Indonesia,Manufacturing/Production
PT Sunprima Nusantara Pembiayaan Balikpapan,Banking / Financial Services
PT Sunray Global,Architectural Services/Interior Designing
PT Sunrider Nusaperdana,Retail / Merchandise
PT Sunrise Bali Realty,Property / Real Estate
PT Sunrise International Persada,Construction/Building/Engineering
PT Sunrise Makmur International,General & Wholesale Trading
PT Sunrise Steel,Manufacturing / Production
PT Sunrise Sukses Indo,General & Wholesale Trading
PT Sunrise Sukses Indo (Marketing Division),General & Wholesale Trading
PT Sunshine Food International,Food & Beverage/Catering/Restaurant
PT Sunstar Mandiri Indo,General & Wholesale Trading
PT Sunstream Indonesia,General & Wholesale Trading
PT Suntech Indonesia jaya,General & Wholesale Trading
PT Suntech Internasional,Automobile / Automotive Ancillary / Vehicle
PT Suntech Inti Perkasa,Computer/Information Technology (Software)
PT Suntech Plastics Industries Batam,Polymer/Plastic/Rubber/Tyres
PT Sunter Lakeside Hotel,Hotel / Hospitality
PT Sunter Pratama,Printing/Publishing
PT Sunter Pratama Mandiri,Food & Beverage/Catering/Restaurant
PT Sunthi Sepuri Indonesia,Healthcare/Medical
PT Suntory Garuda Beverage,Manufacturing/Production
PT Sunwa Technos Indonesia,Electrical & Electronics
PT Sunway Pacific Flow,Manufacturing/Production
PT Sunway Trek Masindo,General & Wholesale Trading
PT Sunwoo Home Indonesia,Manufacturing/Production
PT Sunwood Timber Industries,Manufacturing/Production
PT Sunyoo Heavy Industry,Automobile/Automotive Ancillary/Vehicle
PT SUNZEN INDONESIA,General & Wholesale Trading
PT Sunzo Teknik Pondasi,Construction/Building/Engineering
PT Suparma Tbk,Manufacturing/Production
PT Suparma Tbk (Commercial Division),Manufacturing / Production
