Perusahaan,Sektor
PT Trisco Tailored Apparel Manufacturing,Apparel
PT Triseed Megatama Abadi,General & Wholesale Trading
PT Trisensa Mineral Utama,Mining
PT Trisenta Interior Manufacturing,Manufacturing/Production
PT TRISETA BUANA KARSA,Education
PT Trisha Jaya Elektrindo,Others
PT Trisha Jaya Elektrindo (Surabaya),General & Wholesale Trading
PT Trisigma Indonusa,Advertising / Marketing / Promotion / PR
PT Trisinar Indopratama,Manufacturing/Production
PT Trisindo Asrikarya,Transportation / Logistics
PT TRISINDO GLOBAL PERKASA,Others
PT Trisindo Perkasa Mas,Construction/Building/Engineering
PT Trisindo Prima Cargo,Transportation/Logistics
PT TRISM,Manufacturing/Production
PT Tristan Resources,Consulting (Business & Management)
PT Tristar Finance,Banking / Financial Services
PT Tristar Land,Retail / Merchandise
PT Tristar Makmur Kartonindo,Transportation/Logistics
PT Tristar Sinar Pradhana,Insurance
PT Tristar Solution,Repair & Maintenance Services
PT Tristate Indonesia,Manufacturing / Production
PT Trisula Abadi,Construction / Building / Engineering
PT Trisula Alchemindo,Manufacturing/Production
PT Trisula Garmindo Manufacturing,Textiles / Garment
PT Trisula Insan Tiara,Manufacturing / Production
PT Trisula International Tbk,Manufacturing/Production
PT Trisula Karya Gemilang,Education
PT Trisula Textile Industries,Textiles/Garment
PT TRISUMBER MAKMUR INDAH,Manufacturing/Production
PT Trisumber Makmur Indah,Food & Beverage/Catering/Restaurant
PT Trisurya Lintas Energi,Electrical & Electronics
PT Trisurya Sempana,Manufacturing/Production
PT Trit Indonesia,General & Wholesale Trading
PT Trita Musi Prasada,Manufacturing/Production
PT Tritama Bina Karya,Human Resources Management / Consulting
PT Tritama Mega Persada,Manufacturing / Production
PT Tritama Nusantara,Transportation / Logistics
PT Tritama Nusantara ( Surabaya ),Automobile / Automotive Ancillary / Vehicle
PT Tritama Selaras Makmur,Food & Beverage/Catering/Restaurant
PT Tritama Wirakarsa,Chemical/Fertilizers/Pesticides
PT Tritan Media Mulia,Computer / Information Technology (Software)
PT Tritan Sologo Semesta,Consumer Products/FMCG
PT Tritanu,Others
PT Tritanu Cabang Balikpapan,General & Wholesale Trading
PT Tritanu Cabang Medan,Computer / Information Technology (Hardware)
PT Tritanu Hubs Indonesia,General & Wholesale Trading
PT Tritanu Makassar,Manufacturing / Production
PT Tritech Consult Indonesia,"Consulting (IT, Science, Engineering & Technical)"
PT Tritek Solusi Pratama,Electrical & Electronics
PT Tritin Malindo,Human Resources Management / Consulting
PT Triton Apros,Textiles / Garment
PT Triton Global Maritim,Transportation / Logistics
"PT Triton Network Solution, - Dominopos Pte Ltd development center",Computer/Information Technology (Software)
,
PT Tritunas Bangun Perkasa,Property / Real Estate
PT Tritunggal Abadi Bersama,Arts/Design/Fashion
PT Tritunggal Adikarya Teknik,Construction / Building / Engineering
PT Tritunggal Arthamakmur,General & Wholesale Trading
PT Tritunggal Bangun Sejahtera,Retail / Merchandise
PT Tritunggal Delta Sejahtera (TDSpaint),Manufacturing/Production
PT Tritunggal Dirgantara Maju,Aerospace/Aviation/Airline
PT Tritunggal Inti Abadi,Construction/Building/Engineering
PT Tritunggal Mandiri Solusindo,Healthcare / Medical
PT Tritunggal Mandiri Steel,General & Wholesale Trading
PT Tritunggal Mitra Adiguna,Others
PT Tritunggal Mitra Perdana,Manufacturing / Production
PT Tritunggal Mulia Wisesa,General & Wholesale Trading
PT Tritunggal Multi Cemerlang,Consumer Products/FMCG
PT Tritunggal Orasa Prima Alam Semestra,Food & Beverage/Catering/Restaurant
PT Tritunggal Powerindo Utama,Healthcare/Medical
PT Tritunggal Pratama Multipack,Manufacturing / Production
PT Tritunggal Premium,Retail / Merchandise
PT Tritunggal Putra,Property/Real Estate
PT Tritunggal Putra Jaya,Human Resources Management / Consulting
PT Tritunggal Sejahtera Margawi,Human Resources Management/Consulting
PT Tritunggal Sinarjaya,Consumer Products/FMCG
PT Triutama Realtindo Mandiri (Jakarta),Property/Real Estate
PT Triutama Sistem Indonesia,"Consulting (IT, Science, Engineering & Technical)"
PT Trivatindo Pratama,Manufacturing / Production
PT Trivesta Polymas Perkasa,Manufacturing/Production
PT Triwala Mitra Bestari,General & Wholesale Trading
PT Triwarga Dian Sakti,Automobile / Automotive Ancillary / Vehicle
PT Triwarna Cipta Kreasi,Construction/Building/Engineering
PT Triwijaya Gemalestari,Oil/Gas/Petroleum
PT Triwira Putra Perkasa,Entertainment/Media
PT Trixten Global Internasional,Healthcare/Medical
PT Triyakom,Computer/Information Technology (Software)
PT Triyan Tooling (Dist. Cutting Tool),Manufacturing/Production
PT Triyana Group,Others
PT Triyasa Karya Parama,Architectural Services/Interior Designing
PT Triyasa Propertindo (Member of Tiara Marga Trakindo Group),Property/Real Estate
PT Triyuda Perkasa,Heavy Industrial/Machinery/Equipment
PT Trocon Indah Perkasa,Manufacturing / Production
PT Trojan Propertindo,Property/Real Estate
PT Tronindo Anugrah Jaya,Textiles/Garment
PT Tronti Indonesia,Retail / Merchandise
PT Tropica Greeneries,Others
PT Tropica Mas Pharmaceuticals (Bandung),Healthcare/Medical
PT Tropical Electronic,Manufacturing/Production
PT Tropical Infusions,Hotel/Hospitality
