Perusahaan,Sektor
PT Kartika Bina Medikatama,Healthcare/Medical
PT Kartika Buana Ayu,Exhibitions/Event management/MICE
PT Kartika Cemerlang Sejati,General & Wholesale Trading
PT Kartika Eka Dharma,Transportation/Logistics
PT Kartika Eka Yudha Maritim,Transportation / Logistics
PT Kartika Eka Yudha Maritim (Surabaya),Transportation / Logistics
PT Kartika Food Industry,Food & Beverage/Catering/Restaurant
PT Kartika Inti Sejati,Food & Beverage / Catering / Restaurant
PT Kartika Jaya Makmur,General & Wholesale Trading
PT Kartika Jayamanggala,Retail/Merchandise
PT Kartika Macons,Construction / Building / Engineering
PT Kartika Multi Mining,Mining
PT Kartika Naya,Printing / Publishing
PT Kartika Sinar Mulia,Textiles/Garment
PT Kartika Tirta Hema,Manufacturing / Production
PT Kartika Yudha Perkasa,Transportation/Logistics
PT Kartika Zidan Pratama,Property/Real Estate
PT Kartikawira Adisukses,Food & Beverage/Catering/Restaurant
PT Kartini Cahaya Lestari (Majalah Kartini),Entertainment/Media
PT Kartu Semesta Indonesia,Telecommunication
PT Karuna Centre,Education
PT Karuna Saraswati,General & Wholesale Trading
PT Karung Emas,Polymer / Plastic / Rubber / Tyres
PT Karunia Abadi Anugrah,Retail/Merchandise
PT Karunia Abadi Sejahtera,Property/Real Estate
PT Karunia Adi Sentosa,"Consulting (IT, Science, Engineering & Technical)"
PT Karunia Agung Infiniti,Mining
PT Karunia Alam Indonesia,Manufacturing / Production
PT Karunia Alam Raya Sejati,Agricultural / Plantation / Poultry / Fisheries
PT KARUNIA ALAMINDO UTAMA,Retail/Merchandise
PT Karunia Artha Rahayu,Food & Beverage/Catering/Restaurant
PT Karunia Berca Indonesia,Construction/Building/Engineering
PT Karunia Berca Indonesia (Experienced Candidates),Construction / Building / Engineering
PT Karunia Berkat Sejahtera,Accounting/Audit/Tax Services
PT Karunia Beton Lestari,Manufacturing/Production
PT karunia cantik abadi,Grooming/Beauty/Fitness
PT Karunia Cipta Abadi,Consumer Products / FMCG
PT Karunia Dwi Tunggal,Property / Real Estate
PT Karunia Empat Bersama,Transportation / Logistics
PT Karunia Grafika Multisindo,Printing/Publishing
PT Karunia Indah Cahaya,Manufacturing/Production
PT Karunia Indah Delapan Express,Transportation/Logistics
PT Karunia Indamed Mandiri,Manufacturing / Production
PT Karunia Indo Sentosa,General & Wholesale Trading
PT Karunia Insan Nata Graha,Property/Real Estate
PT Karunia Jatama Sentra,Manufacturing/Production
PT Karunia Jaya Abadi Inds,Food & Beverage/Catering/Restaurant
PT Karunia Jaya Pangan,Others
PT Karunia Jaya Wisata (JW Tour&Travel),Travel/Tourism
PT Karunia Kasih Indah,Agricultural/Plantation/Poultry/Fisheries
PT Karunia Kemilau Korin,Accounting/Audit/Tax Services
PT Karunia Kemilau Permata,Retail / Merchandise
PT Karunia Kencana Inter Global,Manufacturing/Production
PT Karunia Kencana Inter Global (Jakarta Office),Manufacturing/Production
PT Karunia Kreasi Printa,Printing/Publishing
PT Karunia Kreasi Printa Cabang JATAKE,Printing/Publishing
PT Karunia Kreatif Mandiri,Wood/Fibre/Paper
PT Karunia Kuliner Indonesia (Restaurant Remboelan),Food & Beverage/Catering/Restaurant
PT Karunia Mandiri Consultant,"Consulting (IT, Science, Engineering & Technical)"
PT Karunia Megah Mulia,Manufacturing/Production
PT Karunia Mitra Abadi,Heavy Industrial / Machinery / Equipment
PT Karunia Mitra Abadi,Mining
PT Karunia Multi Perkasa,General & Wholesale Trading
PT Karunia Multifinance,Banking/Financial Services
PT Karunia Mulya Abadi,Manufacturing/Production
PT Karunia Perkasa Jaya,Others
PT Karunia Pratama Lintas Teknologi,Others
PT Karunia Pratama Sejahtera,Transportation/Logistics
PT Karunia Prima Engineering,Manufacturing/Production
PT Karunia Rahmat Inti Sejahtera,General & Wholesale Trading
PT Karunia Rejeki Abadi,General & Wholesale Trading
PT Karunia Rumput Laut,Food & Beverage/Catering/Restaurant
PT Karunia Sarana Binangun,Property/Real Estate
PT Karunia Segar Utama,Food & Beverage/Catering/Restaurant
PT Karunia Sejahtera (RayWhite PuloMas),Property / Real Estate
PT Karunia Sejahtera Indah,Hotel / Hospitality
PT Karunia Sejahtera Trans,Transportation/Logistics
PT Karunia Sukses Gemilang,Food & Beverage/Catering/Restaurant
PT Karunia Sukses Utama,Manufacturing / Production
PT Karunia Sumber Mas,Consumer Products / FMCG
PT Karunia Sumber Mas (Jawa Timur),Construction/Building/Engineering
PT Karunia Tehnik Multi Sejahtera,Consulting (Business & Management)
PT Karunia Teknik,Manufacturing / Production
PT Karunia Wahyu Antarnusa (HARRIS HOTEL & RESIDENCE),Hotel / Hospitality
PT Karunia Wijaya Sentosa,General & Wholesale Trading
PT Karuniai Krida Sinergi,"Consulting (IT, Science, Engineering & Technical)"
PT Karuniatama Polypack,Manufacturing / Production
PT Karvak Nusa Geomatika,Others
PT Kary Indomas Elok,Manufacturing/Production
PT Karya Abadi ( Bandung ),Manufacturing / Production
PT Karya Abdi Persada,Electrical & Electronics
PT Karya Adi Kencana,Construction / Building / Engineering
PT Karya Adikita Galvanize,Manufacturing/Production
PT Karya Agung International,Manufacturing / Production
PT Karya Agung Propertindo,Property/Real Estate
PT Karya Agung Sawita,Agricultural / Plantation / Poultry / Fisheries
PT Karya Alam Bahari,Agricultural/Plantation/Poultry/Fisheries
PT Karya Andalan Abadi,Consulting (Business & Management)
PT Karya Anugerah Bersama,Others
PT Karya Anugerah Indah,Printing / Publishing
PT Karya Anugerah Jaya,Food & Beverage/Catering/Restaurant
PT Karya Anugerah Kusuma,Mining
PT Karya Anugerah Rumpin,Agricultural/Plantation/Poultry/Fisheries
PT Karya Anugerah Sejahtera,Polymer / Plastic / Rubber / Tyres
PT Karya Anugerah Sejati Abadi,Consulting (Business & Management)
PT Karya Anugrah Investama,Property/Real Estate
PT Karya Anugrah Multi Packindo,General & Wholesale Trading
PT Karya Anugrah Teknologi (Jakarta),Computer/Information Technology (Hardware)
PT Karya Ardi Prestasi,Heavy Industrial/Machinery/Equipment
PT Karya Aspal Mandiri,General & Wholesale Trading
PT Karya Atap Membrane,Architectural Services/Interior Designing
PT Karya Bahana Unigam,Automobile/Automotive Ancillary/Vehicle
PT Karya Bahari Abadi,Automobile / Automotive Ancillary / Vehicle
PT KARYA BAJA SUKSES,General & Wholesale Trading
PT Karya Baja Sukses,General & Wholesale Trading
PT Karya Bakti Metalasri,Manufacturing / Production
PT Karya Bakti Metalasri,Construction/Building/Engineering
PT Karya Bersama Properti,Property/Real Estate
PT Karya Bersatu Lestari (Jakarta),General & Wholesale Trading
PT Karya Bina Lestari,Healthcare / Medical
PT Karya Bintang Gemilang,Property/Real Estate
PT Karya Boga Ternama,Food & Beverage/Catering/Restaurant
PT Karya Boga Utama,Food & Beverage/Catering/Restaurant
PT Karya Brothers Nusamesindo,General & Wholesale Trading
PT Karya Buana Sejahtera,Transportation/Logistics
PT Karya Budi Agung Sentosa,Construction / Building / Engineering
PT Karya Bumi Baratama,Mining
PT Karya Cakra Mandiri,Polymer/Plastic/Rubber/Tyres
PT Karya Cantika Kusuma,Property / Real Estate
PT Karya Cemerlang Tour Travel,Travel/Tourism
PT Karya Cerebro Kreasi Interaksi,Advertising/Marketing/Promotion/PR
PT Karya Cipta Balindo,Food & Beverage/Catering/Restaurant
PT Karya Cipta Bayu Minapratama,Advertising/Marketing/Promotion/PR
PT Karya Cipta Digital,"Consulting (IT, Science, Engineering & Technical)"
PT Karya Cipta Group,Property / Real Estate
PT Karya Cipta Makmur Abadi,General & Wholesale Trading
PT KARYA CIPTA MANDIRI SEJATI,Construction/Building/Engineering
PT Karya Cipta Pesona,Hotel / Hospitality
PT Karya Cipta Unggul Nusantara,Construction/Building/Engineering
PT Karya Ciptanyata Wisesa,Manufacturing/Production
PT Karya Deli Steelindo,Construction/Building/Engineering
PT Karya Design,Retail / Merchandise
PT Karya Digital,"Consulting (IT, Science, Engineering & Technical)"
PT Karya Digital Nusantara (Lawble),Computer/Information Technology (Software)
PT Karya Digna Indonesia,Consulting (Business & Management)
PT Karya Dinamika Funseason,Property / Real Estate
PT Karya Dua Sahabat Cemerlang,Electrical & Electronics
PT Karya Dua Semesta,Computer / Information Technology (Hardware)
PT Karya Duta Konsulindo,Construction/Building/Engineering
PT Karya Duta Sarana,Transportation / Logistics
PT Karya Dwi Putra,Oil/Gas/Petroleum
PT Karya Ekatama,General & Wholesale Trading
PT Karya Elang Indonesia,Human Resources Management/Consulting
PT Karya Energi Indonesia,General & Wholesale Trading
PT Karya Estetika Indonesia,Grooming/Beauty/Fitness
PT Karya Gemilang Indonusa,Manufacturing/Production
PT Karya Generasi Makmur ( Surabaya ),Retail / Merchandise
PT Karya Giat Sukses Sejahtera,Property/Real Estate
PT Karya Global International,Electrical & Electronics
PT Karya Grafis Indonusa,Arts/Design/Fashion
PT Karya Graha Andara,General & Wholesale Trading
PT Karya Graha Cemerlang,General & Wholesale Trading
PT KARYA GRAHA NITYASA (Tangerang),Construction/Building/Engineering
PT Karya Guna Cipta Sejahtera,Computer / Information Technology (Software)
PT Karya Guna Sumber Perkasa,Gems/Jewellery
PT Karya Hati Gemilang,Advertising/Marketing/Promotion/PR
PT Karya Idaman Bersama,Retail/Merchandise
PT Karya Indah Abadi Terus,Others
PT Karya Indah Anugerah Tumbuh,Manufacturing/Production
PT Karya Indah Mitratama,Healthcare/Medical
PT Karya Indah Sukses (Malang),Property / Real Estate
PT Karya Indonesia Sukses,General & Wholesale Trading
PT Karya Inova Beton Indonesia,Construction/Building/Engineering
PT Karya Insan Dermawan,Education
PT Karya Inspirasi Baru,Construction/Building/Engineering
PT Karya Interarsi Utama,Architectural Services / Interior Designing
PT Karya Interchem Mitraniaga,Oil/Gas/Petroleum
PT Karya Intertek Kencana,Construction/Building/Engineering
PT Karya Inti Petrolleum,Oil / Gas / Petroleum
PT Karya Inti Sinar Pratama,Arts/Design/Fashion
PT Karya Jaya Abadi Propertindo,Property/Real Estate
PT KARYA JAYA SEMBILAN SAUDARA,General & Wholesale Trading
PT Karya Jaya Sukses Prima,Telecommunication
PT Karya Karang Asem Indah,Polymer/Plastic/Rubber/Tyres
PT Karya Karunia Indotama,Human Resources Management / Consulting
PT Karya Kasih Persada,Consulting (Business & Management)
PT Karya Kencana Sumber Sari,Food & Beverage/Catering/Restaurant
PT Karya Kinetama Exactindo,Transportation / Logistics
PT Karya Kinetama Exactindo,Others
PT Karya Kita Bandung,Printing / Publishing
PT Karya Komponen Presisi,Accounting/Audit/Tax Services
PT Karya Konstrindo Gunaestetika,Construction/Building/Engineering
PT Karya Kreasi Pesona Indonesia,Food & Beverage/Catering/Restaurant
PT Karya Kreatif Bersama,Entertainment/Media
PT Karya Kuliner Sejahtera,Food & Beverage / Catering / Restaurant
PT KARYA KUSUMA PERKASA,"Consulting (IT, Science, Engineering & Technical)"
PT Karya Lancar Sejahtera,Construction/Building/Engineering
PT Karya Lima Utama,General & Wholesale Trading
PT Karya Lintas Nusa Sejati,Transportation / Logistics
PT Karya Logam Agung,Heavy Industrial/Machinery/Equipment
PT Karya Makmur,Property/Real Estate
PT Karya Makmur Gemilang,Transportation/Logistics
PT Karya Makmur Integra,Electrical & Electronics
PT Karya Makmur Lancar,Construction / Building / Engineering
PT Karya Makmur Manggala,Manufacturing/Production
PT Karya Makmur Mesindo,Food & Beverage/Catering/Restaurant
PT Karya Makmur Sentosa,Manufacturing/Production
PT Karya Mandiri Agrojaya,Agricultural/Plantation/Poultry/Fisheries
PT karya Mandiri bu bukan P,Food & Beverage / Catering / Restaurant
PT Karya Mandiri Erlyangga,Manufacturing/Production
PT Karya Mandiri Globalindo,Construction/Building/Engineering
PT Karya Mandiri Lestari,Retail/Merchandise
PT Karya Mandiri Marmer,Construction/Building/Engineering
PT Karya Mandiri Nusantara,Transportation / Logistics
PT Karya Mandiri Surya Sejahtera,Construction/Building/Engineering
PT Karya Mandiri(Makasar),Advertising/Marketing/Promotion/PR
PT Karya Manunggal Jati,Human Resources Management/Consulting
PT Karya Mas Sejati,General & Wholesale Trading
PT Karya Master Mandiri Indonesia,Education
PT Karya Medika Indonesia,BioTechnology/Pharmaceutical/Clinical research
PT Karya Mega Bersama,Computer/Information Technology (Software)
PT Karya Mega Kencana,Manufacturing/Production
PT Karya Megah Buton,Oil/Gas/Petroleum
PT Karya Mekar Lestari,Property / Real Estate
PT Karya Mentari Seraya,Architectural Services/Interior Designing
PT Karya Mitra Bestari,Architectural Services / Interior Designing
PT Karya Mitra Digital,Computer/Information Technology (Software)
PT Karya Mitra Maju Bersama,General & Wholesale Trading
PT Karya Mitra Seraya,Arts/Design/Fashion
PT Karya Mitra Tani,Agricultural / Plantation / Poultry / Fisheries
PT Karya Modern Jaya Cabang Bali,Retail / Merchandise
PT Karya Muda Indonesia,Arts / Design / Fashion
PT Karya Muda Kreatif,Advertising/Marketing/Promotion/PR
PT Karya Mulia Glass,Others
PT Karya Mulia Loka Persada,Transportation/Logistics
PT KARYA MULIA TRANSINDO,Others
PT Karya Multi Prima,Construction/Building/Engineering
PT Karya Multi Sejahtera,Human Resources Management / Consulting
PT Karya Murni Prima,Heavy Industrial/Machinery/Equipment
PT Karya Murni Sentosa,Automobile/Automotive Ancillary/Vehicle
PT Karya Nadiso Utama,BioTechnology / Pharmaceutical / Clinical research
PT Karya Naptha Belide,BioTechnology / Pharmaceutical / Clinical research
PT Karya Niaga Abadi,Transportation/Logistics
PT Karya Niaga Utama,"Consulting (IT, Science, Engineering & Technical)"
PT Karya Nireko Warga Nusa,Environment/Health/Safety
PT Karya Pacific Shipping,Transportation/Logistics
PT Karya Pak Oles Tokcer (Bali),Manufacturing/Production
PT Karya Palewagau Sejahtera,Construction/Building/Engineering
PT Karya Palmalindo Abadi,Construction / Building / Engineering
PT Karya Pangan Jaya,Consumer Products / FMCG
PT Karya Pangan Sejahtera,Agricultural/Plantation/Poultry/Fisheries
PT Karya Para Mandiri,Construction / Building / Engineering
PT Karya Parkindo Sinergi,Security/Law Enforcement
PT Karya Paten Indonesia,"Consulting (IT, Science, Engineering & Technical)"
PT Karya Perdana,Construction / Building / Engineering
PT Karya Perdana Utama,Hotel/Hospitality
PT Karya Persada Mandiri,Manufacturing/Production
PT Karya Plasindo,Heavy Industrial/Machinery/Equipment
PT Karya Pratama,General & Wholesale Trading
PT Karya Pratama Mandiri,"Consulting (IT, Science, Engineering & Technical)"
PT Karya Premium Indonesia,Advertising/Marketing/Promotion/PR
PT Karya Prima Anugerah Mandiri,General & Wholesale Trading
PT Karya Prima Lestari,Property / Real Estate
PT Karya Prima Sentosa Abadi,Wood/Fibre/Paper
PT Karya Prima Unggulan,Food & Beverage/Catering/Restaurant
PT KARYA PRIMA USAHATAMA,Human Resources Management/Consulting
PT Karya Propertindo Konsultan,Entertainment/Media
PT Karya Putra Borneo,Mining
PT Karya Putra Grafika,Hotel/Hospitality
PT Karya Putra Lokatirta Mandiri,Transportation/Logistics
PT Karya Putra Mulia ( KPM),Consulting (Business & Management)
PT Karya Putra Nusantara Perkasa,BioTechnology/Pharmaceutical/Clinical research
PT Karya Putra Pembangunan,Food & Beverage / Catering / Restaurant
PT Karya Putra Sangkuriang,Manufacturing/Production
PT Karya Putra Sukses,Manufacturing / Production
PT Karya Putra Surya Gemilang ( Bandung Branch ),Banking / Financial Services
PT Karya Putra Surya Gemilang (KPSG) Malang,Human Resources Management / Consulting
PT Karya Putra Surya Gemilang (KPSG) Medan,Human Resources Management / Consulting
PT Karya Putra Surya Gemilang (KPSG) Samarinda,Human Resources Management / Consulting
PT Karya Putra Surya Gemilang (KPSG) Semarang,Human Resources Management / Consulting
PT Karya Putra Surya Gemilang (Makassar),Human Resources Management/Consulting
PT Karya Putra Surya Gemilang (Surabaya),Human Resources Management / Consulting
PT Karya Rakyat Makmur,General & Wholesale Trading
PT Karya Rezeki Panca Mulia,Construction / Building / Engineering
PT Karya Sarana Global,Construction / Building / Engineering
PT Karya Satria,Advertising/Marketing/Promotion/PR
PT Karya Satya Utama Internasional,General & Wholesale Trading
PT Karya Sehati Mandiri,Manufacturing/Production
PT KARYA SEJAHTERA ABADITAMA,General & Wholesale Trading
PT Karya Sejahtera Pratama,Others
PT Karya Sejati,Manufacturing / Production
PT Karya Sejati Ekspres,Transportation/Logistics
PT Karya Sejati Makmur,Human Resources Management/Consulting
PT Karya Sejati Makmur Jakarta,Repair & Maintenance Services
PT Karya Sejati Readymix,Construction/Building/Engineering
PT Karya Semangat Mandiri,Agricultural/Plantation/Poultry/Fisheries
PT Karya Semesta,General & Wholesale Trading
PT Karya Semesta Investama,Automobile/Automotive Ancillary/Vehicle
Pt Karya Sempurna Abadi,General & Wholesale Trading
PT Karya Setiakawan Utama,Construction/Building/Engineering
PT Karya Setiakawan Utama (Nganjuk),Construction/Building/Engineering
PT Karya Silix Indonesia,General & Wholesale Trading
PT Karya Sinar Harmonis,Property/Real Estate
PT Karya Suka Abadi Cabang Lampung,Manufacturing / Production
PT Karya Sukses Persada,Transportation / Logistics
PT Karya Sukses Sejahtera(BJ-Consultant),Consumer Products / FMCG
PT Karya Sukses Sejati,Manufacturing/Production
PT Karya Sukses UtamaPrima,Agricultural/Plantation/Poultry/Fisheries
PT Karya sumber daya (Batam),Manufacturing / Production
PT Karya Sumiden Indonesia,Manufacturing/Production
PT Karya Sutarindo,Wood/Fibre/Paper
PT Karya Tama Jaya,Construction / Building / Engineering
PT Karya Tangan Indah (Bali),Gems/Jewellery
PT Karya Tangguh Persada,Food & Beverage/Catering/Restaurant
PT Karya Tehnik Pasirindo,General & Wholesale Trading
PT KARYA TEKNIK KARDIM,Manufacturing/Production
PT Karya Terpadu Sejahtera,Others
PT Karya Titan (Karya Titan Group),Hotel/Hospitality
PT Karya Tri Andita,BioTechnology / Pharmaceutical / Clinical research
PT Karya Tuban Cemerlang,Automobile / Automotive Ancillary / Vehicle
PT Karya Tugas Anda,Manufacturing/Production
PT Karya Tunas Glorindo,Manufacturing / Production
PT Karya Tunas Glorindo (Semarang),Manufacturing/Production
PT Karya Unggul,Construction / Building / Engineering
PT Karya Unggulan Cemerlang (TSH Group),Agricultural/Plantation/Poultry/Fisheries
PT Karya Usaha aneka Terjaya,General & Wholesale Trading
PT Karya Utama Berlian,General & Wholesale Trading
PT Karya Utama Indonesia,Architectural Services/Interior Designing
PT Karya Utama Jaya,Property/Real Estate
PT Karya Utama Perdana (Blok M Square),Property / Real Estate
PT Karya Utamaputra Mandiri,Manufacturing/Production
PT Karya Wisesa Sejahtera,Construction/Building/Engineering
PT Karya Yasantara Cakti – ESAB,Manufacturing/Production
PT Karya Zirang Utama,General & Wholesale Trading
PT Karya Zirang Utama Semarang,Automobile/Automotive Ancillary/Vehicle
PT Karyabhakti Insanutama,Oil / Gas / Petroleum
PT Karyacipta Bangun Mandiri,Construction/Building/Engineering
PT Karyadata Komunika,Telecommunication
PT Karyadata Komunika (Semarang),Repair & Maintenance Services
PT karyadata Komunika (Surabaya),Construction / Building / Engineering
PT Karyadeka Alam Lestari,Property/Real Estate
PT Karyadibya Mahardhika,Manufacturing/Production
PT Karyadinamika Anugerahprima,Manufacturing/Production
PT Karyagraha Nusantara,Consulting (Business & Management)
PT Karyaguna Aditama,Advertising / Marketing / Promotion / PR
PT Karyamas Adinusantara,Agricultural/Plantation/Poultry/Fisheries
PT Karyamitra Budisentosa,Manufacturing/Production
PT Karyanet Indo jasa,Consulting (Business & Management)
PT Karyapratama Dunia,Manufacturing/Production
PT Karyaprima Multisarana,General & Wholesale Trading
PT Karyaputra Lokatirta,Transportation/Logistics
PT Karyaputra Suryagemilang ( KPSG ),Human Resources Management/Consulting
PT Karyatama Graha Persada,Accounting/Audit/Tax Services
PT Karyatama Makmur Sentosa,Consulting (Business & Management)
PT Karyatim Surabaya,Construction/Building/Engineering
PT Karyatugas Paramitra,Manufacturing/Production
PT Karyawaja Ekamulia,General & Wholesale Trading
PT Karyayudha Tiaratama,General & Wholesale Trading
PT KAS (Karya Adishin Sukses),Manufacturing / Production
PT Kas Wagon Indonesia,Banking/Financial Services
PT Kasada andalan sejati,General & Wholesale Trading
PT Kasai Teck See Indonesia,Manufacturing/Production
PT Kasakata Kimia,Manufacturing/Production
PT Kasan Indonesia,General & Wholesale Trading
PT Kasana Teknindo Gemilang,Heavy Industrial/Machinery/Equipment
PT Kasandra Persona Prawacana,Consulting (Business & Management)
PT Kasih Agro Mandiri,Manufacturing / Production
PT Kasih Bintang Timur,Human Resources Management / Consulting
PT Kasih Medikatama ( Kasih Ibu ),Hotel / Hospitality
PT Kasili,Food & Beverage / Catering / Restaurant
PT Kasindo Graha Kencana,General & Wholesale Trading
PT Kasmil Kosmos,Architectural Services / Interior Designing
PT Kasoem Pioner Optik,Retail / Merchandise
PT Kasoem Pioner Optik,General & Wholesale Trading
PT Kasongan Bumi Kencana,Mining
PT KASS Indonesia IP Services,Consulting (Business & Management)
PT Kassakki Indo Baja,General & Wholesale Trading
PT Kassakki Indo Baja (Jakarta),General & Wholesale Trading
PT Kastara Prima,Consulting (Business & Management)
PT Kastilmas Persada,Construction / Building / Engineering
PT Kastor Roda Indonesia (Surabaya Branch),Construction / Building / Engineering
PT Kastraco Engineering,General & Wholesale Trading
PT Kasura Indonesia,Food & Beverage / Catering / Restaurant
PT Kaswall Dinamika Indonesia,Mining
PT Kasyasindo Megah Perkasa,Human Resources Management / Consulting
PT Katadata Indonesia,Consulting (Business & Management)
PT Katalis Datesa Prima (Medan),Manufacturing/Production
PT Katama Indonesia,Consulting (Business & Management)
PT Katamaran Sejahtera Abadi (lombok),Hotel/Hospitality
PT Katamata,Heavy Industrial / Machinery / Equipment
PT Katering Makanan Indonesia,Food & Beverage / Catering / Restaurant
PT Katering Sehat Indonesia,Food & Beverage/Catering/Restaurant
PT Katexindo Citramandiri,Manufacturing/Production
PT Katha Cakti,Advertising/Marketing/Promotion/PR
PT Kathrein Indonesia,Manufacturing / Production
PT Kati Kartika Murni,Manufacturing / Production
PT Katolec Indonesia,Manufacturing/Production
PT Katsushiro Indonesia,Heavy Industrial / Machinery / Equipment
PT Katsuyama Finetech Indonesia,Manufacturing/Production
PT Katwara,Wood/Fibre/Paper
PT Kautsar Prasindo Investama,Banking/Financial Services
PT Karya Silix Indonesia,General & Wholesale Trading
PT Karya Sinar Harmonis,Property/Real Estate
PT Karya Suka Abadi Cabang Lampung,Manufacturing / Production
PT Karya Sukses Persada,Transportation / Logistics
PT Karya Sukses Sejahtera(BJ-Consultant),Consumer Products / FMCG
PT Karya Sukses Sejati,Manufacturing/Production
PT Karya Sukses UtamaPrima,Agricultural/Plantation/Poultry/Fisheries
PT Karya sumber daya (Batam),Manufacturing / Production
PT Karya Sumiden Indonesia,Manufacturing/Production
PT Karya Sutarindo,Wood/Fibre/Paper
PT Karya Tama Jaya,Construction / Building / Engineering
PT Karya Tangan Indah (Bali),Gems/Jewellery
PT Karya Tangguh Persada,Food & Beverage/Catering/Restaurant
PT Karya Tehnik Pasirindo,General & Wholesale Trading
PT KARYA TEKNIK KARDIM,Manufacturing/Production
PT Karya Terpadu Sejahtera,Others
PT Karya Titan (Karya Titan Group),Hotel/Hospitality
PT Karya Tri Andita,BioTechnology / Pharmaceutical / Clinical research
PT Karya Tuban Cemerlang,Automobile / Automotive Ancillary / Vehicle
PT Karya Tugas Anda,Manufacturing/Production
PT Karya Tunas Glorindo,Manufacturing / Production
PT Karya Tunas Glorindo (Semarang),Manufacturing/Production
PT Karya Unggul,Construction / Building / Engineering
PT Karya Unggulan Cemerlang (TSH Group),Agricultural/Plantation/Poultry/Fisheries
PT Karya Usaha aneka Terjaya,General & Wholesale Trading
PT Karya Utama Berlian,General & Wholesale Trading
PT Karya Utama Indonesia,Architectural Services/Interior Designing
PT Karya Utama Jaya,Property/Real Estate
PT Karya Utama Perdana (Blok M Square),Property / Real Estate
PT Karya Utamaputra Mandiri,Manufacturing/Production
PT Karya Wisesa Sejahtera,Construction/Building/Engineering
PT Karya Yasantara Cakti – ESAB,Manufacturing/Production
PT Karya Zirang Utama,General & Wholesale Trading
PT Karya Zirang Utama Semarang,Automobile/Automotive Ancillary/Vehicle
PT Karyabhakti Insanutama,Oil / Gas / Petroleum
PT Karyacipta Bangun Mandiri,Construction/Building/Engineering
PT Karyadata Komunika,Telecommunication
PT Karyadata Komunika (Semarang),Repair & Maintenance Services
PT karyadata Komunika (Surabaya),Construction / Building / Engineering
PT Karyadeka Alam Lestari,Property/Real Estate
PT Karyadibya Mahardhika,Manufacturing/Production
PT Karyadinamika Anugerahprima,Manufacturing/Production
PT Karyagraha Nusantara,Consulting (Business & Management)
PT Karyaguna Aditama,Advertising / Marketing / Promotion / PR
PT Karyamas Adinusantara,Agricultural/Plantation/Poultry/Fisheries
PT Karyamitra Budisentosa,Manufacturing/Production
PT Karyanet Indo jasa,Consulting (Business & Management)
PT Karyapratama Dunia,Manufacturing/Production
PT Karyaprima Multisarana,General & Wholesale Trading
PT Karyaputra Lokatirta,Transportation/Logistics
PT Karyaputra Suryagemilang ( KPSG ),Human Resources Management/Consulting
PT Karyatama Graha Persada,Accounting/Audit/Tax Services
PT Karyatama Makmur Sentosa,Consulting (Business & Management)
PT Karyatim Surabaya,Construction/Building/Engineering
PT Karyatugas Paramitra,Manufacturing/Production
PT Karyawaja Ekamulia,General & Wholesale Trading
PT Karyayudha Tiaratama,General & Wholesale Trading
PT KAS (Karya Adishin Sukses),Manufacturing / Production
PT Kas Wagon Indonesia,Banking/Financial Services
PT Kasada andalan sejati,General & Wholesale Trading
PT Kasai Teck See Indonesia,Manufacturing/Production
PT Kasakata Kimia,Manufacturing/Production
PT Kasan Indonesia,General & Wholesale Trading
PT Kasana Teknindo Gemilang,Heavy Industrial/Machinery/Equipment
PT Kasandra Persona Prawacana,Consulting (Business & Management)
PT Kasih Agro Mandiri,Manufacturing / Production
PT Kasih Bintang Timur,Human Resources Management / Consulting
