Perusahaan,Sektor
PT Mitra Jaya Lestari,Construction / Building / Engineering
PT Mitra Jaya Mandiri,Heavy Industrial / Machinery / Equipment
PT Mitra Jaya Sakti,Others
PT Mitra Jaya Trans,Transportation/Logistics
PT Mitra Jayabadi Industrindo,General & Wholesale Trading
PT Mitra Jua Abadi,Human Resources Management/Consulting
PT Mitra Kabel Indonesia (Jakarta),Others
PT Mitra Kabel Indonesia (MKI Group),Construction/Building/Engineering
PT Mitra Kapuas Agro,Agricultural / Plantation / Poultry / Fisheries
PT Mitra Karawang Jaya,Construction / Building / Engineering
PT Mitra Karawangjaya,Manufacturing / Production
PT Mitra Kargo Lestari,Transportation/Logistics
PT MITRA KARINA JAYA - Olin Collection,Manufacturing/Production
PT Mitra Karsa Sejahtera,Property / Real Estate
PT Mitra Karsa Sentosa,Hotel / Hospitality
PT Mitra Karsa Utama,Human Resources Management/Consulting
PT Mitra Karsa Utama (Denpasar),Human Resources Management / Consulting
PT MITRA KARUNIA ANGGARA,Construction/Building/Engineering
PT Mitra Karunia Jaya,Transportation / Logistics
PT Mitra Karya Analitika,General & Wholesale Trading
PT Mitra Karya Industri,Accounting/Audit/Tax Services
PT Mitra Karya Informatika,"Consulting (IT, Science, Engineering & Technical)"
PT Mitra Karya Inovasi,Manufacturing / Production
PT Mitra Karya Japindo,Arts/Design/Fashion
PT Mitra Karya Makmur,Construction / Building / Engineering
PT Mitra Karya Manajemen,Food & Beverage/Catering/Restaurant
PT Mitra Karya Mandiri,Property/Real Estate
PT Mitra Karya Manufaktur Bandung,Manufacturing / Production
PT Mitra Karya Sarana,Manufacturing / Production
PT Mitra Karya Texindo,Textiles/Garment
PT Mitra Karya Utama Sentosa (Surabaya),Human Resources Management/Consulting
PT Mitra Karyamas Agung,Construction/Building/Engineering
PT Mitra Karyausaha Sejahtera,Manufacturing / Production
PT MITRA KEBAYORAN GRHA,Property/Real Estate
PT Mitra Kelola Insani,Consulting (Business & Management)
PT Mitra Kencana Amanah Jaya,Food & Beverage/Catering/Restaurant
PT Mitra Kencana Amanah Jaya (Bali Buddha),Food & Beverage / Catering / Restaurant
PT Mitra Kencana Propertindo,Construction/Building/Engineering
PT MITRA KERJA MUDA,Printing/Publishing
PT Mitra Kerja Utama,Human Resources Management/Consulting
PT Mitra Kharisma Texindo,Textiles/Garment
PT Mitra Khatulistiwa,Others
PT Mitra Komunikasi Indonesia,Telecommunication
PT Mitra Komunikasi Nusantara Tbk,Telecommunication
PT Mitra Konstruksi Renovasi,Construction/Building/Engineering
PT Mitra Konsultan,Consulting (Business & Management)
PT Mitra Konsultansi Indonesia,"Consulting (IT, Science, Engineering & Technical)"
PT Mitra Konsultindo,Human Resources Management / Consulting
PT Mitra Korpora Solusindo,Consulting (Business & Management)
PT Mitra Kreasi (Cengkareng),Construction/Building/Engineering
PT Mitra Kreasi Promosindo,Exhibitions/Event management/MICE
PT Mitra Kreasi Selaras,Human Resources Management/Consulting
PT Mitra Kreasi Sinergi,Construction / Building / Engineering
PT Mitra Kreasidharma ( Lampung ),Chemical/Fertilizers/Pesticides
PT Mitra Kreasidharma (padang),Agricultural / Plantation / Poultry / Fisheries
PT Mitra Kreasidharma (Salim Agrochemical Division),Agricultural/Plantation/Poultry/Fisheries
PT Mitra KreasiDharma(Surakarta),Manufacturing / Production
PT Mitra Krida Perkasa,Automobile/Automotive Ancillary/Vehicle
PT Mitra Kualitas Utama,Consulting (Business & Management)
PT Mitra Kuliner Halim,Food & Beverage/Catering/Restaurant
PT Mitra Kuliner Internasional,Food & Beverage/Catering/Restaurant
PT Mitra Langgeng Bersaudara,Grooming/Beauty/Fitness
PT Mitra Langgeng Sejati,Human Resources Management/Consulting
PT Mitra Laplace Mandiri,"Consulting (IT, Science, Engineering & Technical)"
PT Mitra Laras Sekarya (MLS Consulting),Human Resources Management / Consulting
PT Mitra Lautan Nusantara,Mining
PT Mitra Legi Sampoerna,Manufacturing/Production
PT Mitra Lestari Bumi Abadi,Electrical & Electronics
PT Mitra Lestari Motorindo ( Mitra 2000 ),Automobile/Automotive Ancillary/Vehicle
PT Mitra Lestari Sejati,Textiles / Garment
PT Mitra Lestari Sentosa,Manufacturing/Production
PT Mitra Lestari Sportindo,Retail/Merchandise
PT Mitra Lingkungan Duta Consult (DHV Indonesia),"Consulting (IT, Science, Engineering & Technical)"
PT MItra Logam Pratama,General & Wholesale Trading
PT Mitra Maha Cipta,Accounting/Audit/Tax Services
PT Mitra Maju Bersama Makmur,General & Wholesale Trading
PT Mitra Maju Sukses,Mining
PT Mitra Makmur Berkat Selaras,Manufacturing/Production
PT Mitra Makmur Dwijaya,Polymer/Plastic/Rubber/Tyres
PT Mitra makmur gemilang,Manufacturing / Production
PT Mitra Makmur Mulia Bersama,Retail/Merchandise
PT Mitra Makmur Sahabat,General & Wholesale Trading
PT Mitra Makmur Sukses,Retail / Merchandise
PT Mitra Makmur Transport,Transportation/Logistics
PT Mitra Makmur Veneerindo,Wood/Fibre/Paper
PT Mitra Manajemen Bisnis Solusindo,Consulting (Business & Management)
PT Mitra Mandara Swasti,Property / Real Estate
PT Mitra Mandiri Informatika,Computer/Information Technology (Software)
PT Mitra Mandiri Komputindo,Others
PT MITRA MANDIRI KONSULTAMA,General & Wholesale Trading
PT Mitra Mandiri Riset,Retail/Merchandise
PT MITRA MANDIRI TOWER,Others
PT Mitra Manggala Sentosa,Consulting (Business & Management)
PT Mitra Manna,Food & Beverage/Catering/Restaurant
PT MITRA MANUNGGAL,Retail/Merchandise
PT Mitra Mapan Abadi,Healthcare/Medical
PT Mitra Mariska Bersaudara,Human Resources Management / Consulting
PT Mitra Maslahat Utama,Food & Beverage/Catering/Restaurant
PT Mitra Matra Teknika,Electrical & Electronics
PT Mitra Maxima Media,Entertainment / Media
PT Mitra Maxima Profitamas,Computer/Information Technology (Hardware)
PT Mitra Media Cakrawala,Entertainment/Media
PT Mitra Media Perkasa,Manufacturing / Production
PT MITRA MEDIA VISINDO,Oil/Gas/Petroleum
PT Mitra Meditrans Indonesia,Transportation / Logistics
PT Mitra Mega Karya,Architectural Services/Interior Designing
PT Mitra Mega Kencana,Manufacturing / Production
PT Mitra Mega Persada,Manufacturing / Production
PT Mitra Mega Rasa,Food & Beverage/Catering/Restaurant
PT Mitra Megah Profitamas,Automobile/Automotive Ancillary/Vehicle
PT Mitra Megah Sentosa,Property/Real Estate
PT Mitra Megah Sukses,Manufacturing/Production
PT Mitra Megatama Abadi,Accounting/Audit/Tax Services
PT Mitra Melangkah Bersama,General & Wholesale Trading
PT Mitra Migas Mandiri,Oil/Gas/Petroleum
PT Mitra Motor Semesta,Automobile/Automotive Ancillary/Vehicle
PT Mitra Moulding Sentosa,Manufacturing/Production
PT Mitra Muda Inti Berlian,General & Wholesale Trading
PT Mitra Muda Reksa Mandiri(Lampung),Human Resources Management / Consulting
PT Mitra Mulia Joya Persada,Property / Real Estate
PT Mitra Mulia Mahakam,Others
PT Mitra Mulia Makmur,Manufacturing / Production
PT Mitra Mulia Manunggal,Retail/Merchandise
PT Mitra Multi Chemicals,General & Wholesale Trading
PT Mitra Multi Entertainmindo,Entertainment/Media
PT Mitra Multi Packaging,Manufacturing/Production
PT Mitra Multi Perwira,Chemical / Fertilizers / Pesticides
PT MITRA MUSI PUMP INDONESIA (Palembang),Heavy Industrial/Machinery/Equipment
PT Mitra Nasional Kualitas,Consumer Products / FMCG
PT Mitra Niaga Andalan (Stone Mart),Retail/Merchandise
PT Mitra Niaga Gemilang,General & Wholesale Trading
PT Mitra Niaga International,Transportation / Logistics
PT Mitra Niaga Jaya Manggala,General & Wholesale Trading
PT Mitra Niaga Metrindo,Electrical & Electronics
pt mitra optima talenta,Human Resources Management/Consulting
PT Mitra Optima Talenta (Bekasi),Human Resources Management/Consulting
PT MITRA PACK,Others
PT Mitra Pajakku,Accounting/Audit/Tax Services
PT Mitra Palmil,Polymer / Plastic / Rubber / Tyres
PT Mitra Pangan Abadi,Food & Beverage / Catering / Restaurant
PT Mitra Pangan Mandiri Surabaya,Manufacturing/Production
PT Mitra Pangan Nusantara,General & Wholesale Trading
PT Mitra Parama Lestari,Manufacturing/Production
PT Mitra Pasifik Inovasi,Education
PT Mitra Pasifik Solusindo,Computer/Information Technology (Software)
PT MITRA PASIR INDONESIA,Mining
PT Mitra Pelajar Indonesia (Jakarta),Education
PT Mitra Pelita Internusa,General & Wholesale Trading
PT Mitra Pembayaran Elektronik,Banking/Financial Services
PT Mitra Pemimpin Terang Indonesia,Consulting (Business & Management)
PT Mitra Pemuda (Head Office),Construction / Building / Engineering
PT Mitra Pengusaha Indonesia,Human Resources Management / Consulting
PT Mitra Pengusaha Indonesia (Kudus),Human Resources Management/Consulting
PT Mitra Penjualan Timur,Accounting/Audit/Tax Services
PT Mitra Perdana Nuansa,Property/Real Estate
PT Mitra Periangan Persada ( Tasik & Banjar ),General & Wholesale Trading
PT Mitra Perkasa Bersama Indonesia,Construction/Building/Engineering
PT Mitra Permai Lestari,Others
PT Mitra Permata Mandiri (Surabaya),Travel / Tourism
PT Mitra Pilar Sejahtera,Automobile / Automotive Ancillary / Vehicle
PT Mitra Pinasthika Mulia,Automobile / Automotive Ancillary / Vehicle
PT Mitra Pinasthika Mustika (Gresik),Manufacturing / Production
PT Mitra Pinasthika Mustika (Medan),Automobile / Automotive Ancillary / Vehicle
PT Mitra Pinasthika Mustika (MPM Rent),Automobile/Automotive Ancillary/Vehicle
PT Mitra Pinasthika Mustika (Ngagel),Automobile / Automotive Ancillary / Vehicle
PT Mitra Pinasthika Mustika finance (cabang Panam),Banking / Financial Services
PT Mitra Pinasthika Mustika Finance (MPM Finance),Banking/Financial Services
PT Mitra Pinasthika Mustika Pontianak,Automobile / Automotive Ancillary / Vehicle
PT Mitra Pinasthika Mustika Tbk,Retail/Merchandise
PT Mitra Pinasthika Mustika Tbk ( Jakarta ),Automobile/Automotive Ancillary/Vehicle
PT Mitra Polindo,Retail / Merchandise
PT Mitra Pondasi Tama,Construction / Building / Engineering
PT Mitra Pratama Mobilindo Cabang Semarang,Automobile/Automotive Ancillary/Vehicle
PT Mitra Pratama Mobilindo Cabang Solo,Automobile / Automotive Ancillary / Vehicle
PT Mitra Pratama Mobilindo Cabang Yogyakarta,Automobile / Automotive Ancillary / Vehicle
PT Mitra Pratama Sriwijaya,Consumer Products / FMCG
PT MITRA PRATAMA SUBUR JAYA,Retail/Merchandise
PT Mitra Prestasi,Hotel/Hospitality
PT Mitra Prestasi Abadi,Construction/Building/Engineering
PT Mitra Prima Anugerah,Heavy Industrial/Machinery/Equipment
PT Mitra Prima Galameko ( Century21 Prima ),Property/Real Estate
PT Mitra Prima Indah,Banking/Financial Services
PT Mitra Prima Internasional,Mining
PT Mitra Prima Kesrindo,Healthcare/Medical
PT MITRA PRIMA LESTARI,General & Wholesale Trading
PT Mitra Prima Medika,Manufacturing / Production
PT Mitra Prima Rasa,Food & Beverage/Catering/Restaurant
PT Mitra Prima Utama,Human Resources Management / Consulting
PT Mitra Prodin,Manufacturing/Production
PT Mitra produktif Indonesia,Consulting (Business & Management)
PT Mitra Produktif Indonesia,Human Resources Management/Consulting
PT Mitra profesi Indonesia,Accounting/Audit/Tax Services
PT Mitra Propaint Mandiri,Manufacturing / Production
PT Mitra Puri Mahkota,Others
PT Mitra Puri Maranatha,Automobile / Automotive Ancillary / Vehicle
PT Mitra Putra Berjaya,Food & Beverage/Catering/Restaurant
PT Mitra Putra Perkasa,Manufacturing/Production
PT Mitra Raharjatama,Manufacturing/Production
PT Mitra Rajawali,Advertising/Marketing/Promotion/PR
PT Mitra Ravindra Internasional,Computer/Information Technology (Software)
PT Mitra Reka Nusa,Accounting / Audit / Tax Services
PT Mitra Rencana Edukasi,Consulting (Business & Management)
PT Mitra Rental Copierindo,Retail / Merchandise
PT Mitra Retailindo Citratama,Retail / Merchandise
PT Mitra Rifa Selaras,Healthcare / Medical
PT Mitra Rubber Industries,Manufacturing/Production
PT Mitra Sahabat Selaras,Electrical & Electronics
PT Mitra Sanadi Putra,Consulting (Business & Management)
PT Mitra Sarana Berdikari,Agricultural / Plantation / Poultry / Fisheries
PT Mitra Sarana Cemerlang,Computer / Information Technology (Software)
PT Mitra Sarana Purnama,Food & Beverage / Catering / Restaurant
PT Mitra Sarana Putra,General & Wholesale Trading
PT Mitra Saruta Indonesia,Manufacturing/Production
PT MITRA SATU VISI,Architectural Services/Interior Designing
PT Mitra Satya Jaya (Jakarta),General & Wholesale Trading
PT Mitra Sawit Jambi,Manufacturing / Production
PT Mitra Sehat Indonesia,Manufacturing/Production
PT Mitra Sehati Sekata,Retail/Merchandise
PT Mitra Sejahtera Intiutama,Computer / Information Technology (Software)
PT Mitra Sejahtera Mandiri,Construction/Building/Engineering
PT Mitra Sejahtera Nusantara Indonesia (DUGDUG),Food & Beverage/Catering/Restaurant
PT Mitra Sejati Bogatama,Manufacturing / Production
PT Mitra Sejati Husada,Healthcare/Medical
PT Mitra Sejati Makmur,Property / Real Estate
PT Mitra Sejuk Selaras,Electrical & Electronics
PT Mitra Selaras Griyatama,Architectural Services/Interior Designing
PT Mitra Selaras Hutama Energi,Construction / Building / Engineering
PT Mitra Selaras Internusa,Accounting/Audit/Tax Services
PT Mitra Selaras Nusantara,Computer / Information Technology (Software)
PT Mitra Selaras Sejati,Property/Real Estate
PT Mitra Semarang,General & Wholesale Trading
PT Mitra Sempurna Abadi,Oil / Gas / Petroleum
PT Mitra Semua Solusi,Others
PT Mitra Sentosa Abadi Transindo,General & Wholesale Trading
PT Mitra Sentosa International,General & Wholesale Trading
PT Mitra Sentosa Plastik Industri,Manufacturing / Production
PT Mitra Sentral Terpadu,"Consulting (IT, Science, Engineering & Technical)"
PT Mitra Sentral Utama,Education
PT Mitra Serasi Mandiri,Human Resources Management/Consulting
PT Mitra Servis,Repair & Maintenance Services
PT Mitra Servisindo Utama,Computer / Information Technology (Software)
PT Mitra Setia Budi Indonesia,Human Resources Management / Consulting
PT Mitra Setia Budi Sejahtera,Retail/Merchandise
PT Mitra Setia Jaya,Manufacturing / Production
PT MITRA SETIA NIAGA,General & Wholesale Trading
PT Mitra Sinbaya Perkasa Indonesia,Food & Beverage/Catering/Restaurant
PT Mitra Sindo Sukses,Property / Real Estate
PT Mitra Sinergi Adhitama,Construction / Building / Engineering
PT Mitra Sinergi Distribusi,Computer/Information Technology (Hardware)
PT Mitra Sinergi Internasional,Human Resources Management/Consulting
PT Mitra Sinergi Intisolusi,Computer/Information Technology (Software)
PT Mitra Sistem Integrasi,Telecommunication
PT Mitra Solid Perkasa,"Consulting (IT, Science, Engineering & Technical)"
PT Mitra Solusi Globalindo Perkasa,Advertising / Marketing / Promotion / PR
PT Mitra Solusi Infokom,Computer / Information Technology (Software)
PT Mitra Solusi Jakarta,Human Resources Management/Consulting
PT Mitra Solusi Taxindo,Accounting / Audit / Tax Services
PT Mitra Solusi Telematika,"Consulting (IT, Science, Engineering & Technical)"
PT Mitra Solutions,Call Center/IT-Enabled Services/BPO
PT Mitra Stania Prima,Mining
PT Mitra Suara Sejati,Manufacturing / Production
PT Mitra Sukses Aditama (MSA),Entertainment / Media
PT Mitra Sukses Bahagia,Manufacturing / Production
PT Mitra Sukses Bangun Property,Property/Real Estate
PT Mitra Sukses Investama,Others
PT Mitra Sukses Kelola Property,Property/Real Estate
PT Mitra Sukses Kontrindo,Agricultural/Plantation/Poultry/Fisheries
PT MITRA SUKSES NASIONAL,Grooming / Beauty / Fitness
PT Mitra Sumber Niaga,Chemical/Fertilizers/Pesticides
PT Mitra Suplai Sentosa,General & Wholesale Trading
PT Mitra Surya Solusindo,Electrical & Electronics
PT Mitra Swakarsa Lestari,Manufacturing / Production
PT Mitra Tama Gemilang,Others
PT Mitra Tamiang Utama,Heavy Industrial/Machinery/Equipment
PT Mitra Tata Abadi Bersama,Construction/Building/Engineering
PT Mitra Tata Kerja,Human Resources Management / Consulting
PT Mitra Teknik Sukses,Repair & Maintenance Services
PT Mitra Teknologi Solusindo,"Consulting (IT, Science, Engineering & Technical)"
PT Mitra Teleinformatika Perkasa,Computer/Information Technology (Software)
PT MITRA TELEMEDIA MANUNGGAL,Entertainment/Media
PT Mitra Tera Akurasi,Repair & Maintenance Services
PT Mitra Top Express,Transportation / Logistics
PT Mitra Traktor Cakrabuana (Pekanbaru),Others
PT Mitra Transaksi Indonesia,Banking/Financial Services
PT Mitra Transindo Perkasa,Consumer Products/FMCG
PT Mitra Tunggal Abadi,Education
PT MITRA UNIT PLASTINDO CEMERLANG,Retail/Merchandise
PT Mitra Usaha Abadi,Tobacco
PT MITRA USAHA HARTA GEMILANG,Automobile/Automotive Ancillary/Vehicle
PT Mitra Usaha Pandu Artha,General & Wholesale Trading
PT Mitra Usaha Sukses Sejahtera,Others
PT MITRA USAHA TRAKINDO,Manufacturing/Production
PT Mitra Utama Agathon,Others
PT Mitra Utama Express,Transportation / Logistics
PT Mitra Utama Grafika,Printing / Publishing
PT Mitra Utama Madani,Banking/Financial Services
PT Mitra Utama Madani (Bandung),Human Resources Management / Consulting
PT Mitra Utama Makmur,General & Wholesale Trading
PT Mitra Utama Solusi Telematika,Telecommunication
PT Mitra Wira Pratama,Others
PT Mitrabahtera Segara Sejati Tbk,Marine/Aquaculture
PT Mitrabara Adiperdana Tbk (Jakarata),Mining
PT Mitraboga Intisarana Mandiri,Food & Beverage/Catering/Restaurant
PT Mitrabuana Citra Abadi,Automobile/Automotive Ancillary/Vehicle
PT MitraBuana Jaya Lestari,Hotel/Hospitality
PT Mitrabuana Sukses,General & Wholesale Trading
PT Mitrabuana Widyasakti,Stockbroking/Securities
PT Mitraco Intrada,General & Wholesale Trading
PT Mitracomm Ekasarana,Human Resources Management/Consulting
PT Mitracomm Ekasarana Bali,Human Resources Management / Consulting
PT Mitrada Sinergy,Oil / Gas / Petroleum
pt mitradeka,Others
PT Mitradeka Mandiri,Repair & Maintenance Services
PT Mitragamma Swara (Bandung),Entertainment / Media
PT Mitragarment Indoraya,Textiles/Garment
PT Mitragas Asia Perkasa,Oil / Gas / Petroleum
PT Mitragondola Kreasiprima,General & Wholesale Trading
PT Mitraguna Adikriya,Advertising / Marketing / Promotion / PR
PT Mitraguna Sejatilestari,Consumer Products / FMCG
PT Mitraindo Abadi Selaras,Advertising / Marketing / Promotion / PR
PT MitraInti,General & Wholesale Trading
PT Mitrais,Computer/Information Technology (Software)
PT Mitrajaya Pasopati,General & Wholesale Trading
PT Mitrajaya Teknindo,General & Wholesale Trading
PT Mitrajet Optima Solusi,General & Wholesale Trading
PT Mitrakimia Gunaserasi,Chemical / Fertilizers / Pesticides
PT Mitralab Buana,Chemical/Fertilizers/Pesticides
PT Mitralanggeng Prama Konstruksi,Construction/Building/Engineering
PT Mitralink Solusi,Computer/Information Technology (Software)
PT Mitramas Artha Griya,Accounting / Audit / Tax Services
PT Mitramedia Lestari Nusantara,Consulting (Business & Management)
PT MITRAMEGA PACIFIC SAMUDERA,Manufacturing/Production
PT Mitrametal Perkasa,Automobile / Automotive Ancillary / Vehicle
PT Mitramulia Lestari,Heavy Industrial / Machinery / Equipment
PT Mitranet Mitra Utama,Computer / Information Technology (Software)
PT Mitraniaga Usaha Mandiri,Manufacturing/Production
PT Mitrapak Era Mandiri (Surabaya),Consumer Products / FMCG
PT Mitrapak Eramandiri,Food & Beverage/Catering/Restaurant
PT Mitrapermata Indah,Repair & Maintenance Services
PT Mitrapiranti Usaha,Transportation / Logistics
PT Mitraplus Filter Indonesia,General & Wholesale Trading
PT Mitraprasetya Esensial Persada,Chemical/Fertilizers/Pesticides
PT Mitrasamaya Sejati,Healthcare/Medical
PT Mitrasarana Indonippon Logistics,Transportation / Logistics
PT MITRASARANA PRIMA MANDIRI,Automobile/Automotive Ancillary/Vehicle
PT Mitrasari Prima,Agricultural/Plantation/Poultry/Fisheries
PT Mitrasatrya Perkasautama,Food & Beverage/Catering/Restaurant
PT Mitrasatwa Langlang Buana,Healthcare/Medical
PT Mitrasia Jasa,Repair & Maintenance Services
PT Mitrasoft Infonet,Computer / Information Technology (Software)
PT Mitrasolusi Binadaya,"Consulting (IT, Science, Engineering & Technical)"
PT Mitrasolusi Binadaya (PTMB),Construction / Building / Engineering
PT Mitrasukses Engineering Indonesia (Pasuruan),Construction/Building/Engineering
"PT MITRASUKSES ENGINEERING INDONESIA, PASURUAN",Others
PT Mitratama Perkasa,Mining
PT Mitratama Rasa Sejati,Consumer Products/FMCG
PT Mitratani Agro Unggul,Agricultural/Plantation/Poultry/Fisheries
PT Mitratanker Samudra,Others
PT Mitratex Konsultan,"Consulting (IT, Science, Engineering & Technical)"
PT Mitrausaha Gentaniaga (Honda Mugen),Automobile/Automotive Ancillary/Vehicle
PT Mitrausaha Jayamandiri,Heavy Industrial / Machinery / Equipment
PT MITREKA CIPTA,Retail/Merchandise
PT Mitreka citra tama,Electrical & Electronics
PT Mitreka Solusi Indonesia (Jakarta),"Consulting (IT, Science, Engineering & Technical)"
PT Mitrindo Duta Prakarsa,Construction / Building / Engineering
PT Mitsi Citra Mandiri,Oil/Gas/Petroleum
PT Mitsindo Visual Pratama,Manufacturing / Production
PT Mitsol Teknik Indonesia,Heavy Industrial/Machinery/Equipment
PT MITSUBA INDONESIA,Manufacturing/Production
PT Mitsubishi Chemical Indonesia,Chemical/Fertilizers/Pesticides
PT Mitsubishi Electric Automotive Indonesia,Automobile/Automotive Ancillary/Vehicle
PT Mitsubishi Electric Indonesia,Electrical & Electronics
PT Mitsubishi Jaya Elevator and Escalator,Heavy Industrial/Machinery/Equipment
PT Mitsubishi Krama Yudha Motors and Manufacturing,Manufacturing / Production
PT Mitsubishi Logistics Indonesia,Transportation/Logistics
PT Mitsubishi Motors Krama Yudha Indonesia,Manufacturing/Production
PT MITSUBISHI NUSANTARA DEPOK,Automobile/Automotive Ancillary/Vehicle
PT Mitsubishi Sumitomo Joint Opera,Automobile/Automotive Ancillary/Vehicle
PT Mitsubishi UFJ Lease & Finance Indonesia,Banking/Financial Services
PT Mitsuboshi Belting Indonesia,Polymer/Plastic/Rubber/Tyres
PT Mitsuboshi Belting Indonesia (Surabaya Branch),Manufacturing / Production
PT Mitsui Indonesia,General & Wholesale Trading
PT Mitsui Kinzoku Catalysts Jakarta,Manufacturing/Production
PT Mitsui Leasing Capital Indonesia,Banking/Financial Services
PT Mitsui Leasing Capital Indonesia (Indonesia Career Expo Jakarta 2016),Banking/Financial Services
PT Mitsui O.S.K Lines Indonesia,Transportation/Logistics
PT Mitsui Soko Indonesia,Manufacturing / Production
PT MITSUI-SOKO INDONESIA,Transportation/Logistics
PT Mitsutoyo Indonesia,Manufacturing/Production
PT Mitsuyoshi Manufacturing Indonesia (jakarta),Manufacturing/Production
PT Mitubishi Chemical Indonesia,Mining
PT Mitutoyo Indonesia,Heavy Industrial/Machinery/Equipment
PT Miura Indonesia,Heavy Industrial / Machinery / Equipment
PT Miwon Indonesia,Food & Beverage/Catering/Restaurant
PT Miwon Indonesia,Manufacturing/Production
PT Mix Media Marketing,Entertainment/Media
PT Mixerindo Cipta Persada,Others
PT Mixtra Inti Tekindo,Consulting (Business & Management)
PT Miyuki Indonesia,Manufacturing/Production
PT Miyusama Services,Education
PT MIZ MOREN,Food & Beverage / Catering / Restaurant
PT Mizan Dian Semesta (Bandung),Printing/Publishing
PT Mizan Media Utama ( Jakarta ),Advertising / Marketing / Promotion / PR
PT Mizan Media Utama (jakarta),"Consulting (IT, Science, Engineering & Technical)"
PT Mizan Publika,Printing/Publishing
PT Mizan Pustaka,Printing/Publishing
PT Mizuho Balimor Finance,Banking/Financial Services
PT Mizupon Mota Trading,Construction/Building/Engineering
PT Mizushima Metal Works Indonesia,Manufacturing / Production
PT MJBH Management Indonesia,Hotel/Hospitality
PT MJDMC Perjalanan Indonesia,Travel/Tourism
PT MJT,General & Wholesale Trading
PT MK Prima Indonesia,Automobile/Automotive Ancillary/Vehicle
PT MKFF Indonesia,Manufacturing/Production
PT MKlaud Adhi Pratama,Advertising/Marketing/Promotion/PR
PT MKSS Makassar,Manufacturing/Production
PT MLA Chemicals Indonesia,Chemical/Fertilizers/Pesticides
PT MLI,Others
PT MLV Teknologi,"Consulting (IT, Science, Engineering & Technical)"
PT MLW Telecom,Telecommunication
PT Mm Star International,Advertising / Marketing / Promotion / PR
PT MMC Consulting,Consulting (Business & Management)
PT MMC Metal Fabrication,Manufacturing / Production
PT MMD Mining Machinery Indonesia,Accounting/Audit/Tax Services
PT MML Ceramic Indonesia,General & Wholesale Trading
PT MNC Asuransi Indonesia,Insurance
PT MNC Finance,Banking / Financial Services
PT MNC Finance (Malang),Banking / Financial Services
PT MNC Finance Cabang Bontang,Banking / Financial Services
PT MNC Finance Cabang Kisaran,Banking / Financial Services
PT MNC Finance Cabang Pekanbaru,Banking / Financial Services
PT MNC Finance-Cabang Lampung,Banking/Financial Services
PT MNC GS Homeshopping,Retail/Merchandise
PT MNC Investama Tbk,Banking/Financial Services
PT MNC Kabel Mediacom,Advertising / Marketing / Promotion / PR
PT MNC Land Tbk,Property/Real Estate
PT MNC Life Assurance (Balikpapan),Insurance
PT MNC Life Assurance (Kudus),Insurance
PT MNC Life Assurance (Manado),Entertainment / Media
PT MNC Life Assurance (Semarang),Insurance
PT MNC Life Assurance (Yogyakarta),Insurance
PT MNC Radio Networks,Entertainment/Media
PT MNC Sky Vision ( Indovision ) Cabang Makassar,Entertainment / Media
PT MNC Sky Vision (Balikpapan),Entertainment / Media
PT MNC Sky Vision Kudus,Telecommunication
PT MNC Sky Vision Tbk,Entertainment/Media
PT MNC Sky Vision- Palembang,General & Wholesale Trading
PT MNC Sky Vision- Semarang,General & Wholesale Trading
PT MNC TBK QQ MNC CONTENT,Entertainment/Media
PT MNC Tencent,Entertainment / Media
PT Mnet Indonesia (Batam),Computer/Information Technology (Software)
PT MNI Entertainment,Entertainment / Media
PT MNI Global,Advertising / Marketing / Promotion / PR
PT Mo-ah Tech Mega Jaya Abadi Indonesia,Others
PT Mob Anggun Kosmetika,Retail/Merchandise
PT Mobafone Indonesia,Telecommunication
PT Mobar Sarana Energi,Heavy Industrial/Machinery/Equipment
PT Mobi Technology Indonesia,Telecommunication
PT Mobil Iklan Indonesia,Advertising/Marketing/Promotion/PR
PT Mobil Nasional Intim,Automobile/Automotive Ancillary/Vehicle
PT Mobil Satu Asia,Others
PT Mobil Wow,Automobile/Automotive Ancillary/Vehicle
PT Mobile Commerce Indonesia,Computer / Information Technology (Software)
PT Mobile Sarana Sentosa (Mobilecom),Computer/Information Technology (Hardware)
PT Mobile Service Technology,Computer/Information Technology (Software)
PT Mobile Solution,Retail/Merchandise
