Perusahaan,Sektor
PT LSHR Jakarta,Food & Beverage/Catering/Restaurant
PT LT Teknik Indonesia,Oil/Gas/Petroleum
PT Lu Sen Mining Indonesia,Mining
PT Lu Sen Mining Indonesia (Bali),Mining
PT Luas Birus Utama,Chemical/Fertilizers/Pesticides
PT Lubana Sukses Abadi,Printing/Publishing
PT Luber Mitra Abadi,Hotel/Hospitality
PT Lubrilab Indonesia (Bandung),BioTechnology / Pharmaceutical / Clinical research
PT Lubrilab Indonesia (Head Office),Chemical/Fertilizers/Pesticides
PT Lubrilab Indonesia (Kelapa Gading),Construction/Building/Engineering
PT Lubrindo Kurnia Perkasa,Manufacturing/Production
PT Lubrindo Utama Indonesia,Oil / Gas / Petroleum
PT Lubuk Minturun Konstruksi Persada,Construction / Building / Engineering
PT Luby Indonesia,Electrical & Electronics
PT Luceli Pangan Indonesia,Consumer Products/FMCG
PT Luceli Pangan Indonesia,Accounting/Audit/Tax Services
PT Lucent Lestari Indah,Computer / Information Technology (Software)
PT LUCID Communications,Advertising / Marketing / Promotion / PR
PT Luck Soil Indonesia,Chemical / Fertilizers / Pesticides
PT Luckland Construction Indonesia,Architectural Services/Interior Designing
PT Lucky Abadi Textile Factory,Manufacturing / Production
PT Lucky Indah Keramik,Manufacturing/Production
PT Lucky Print Abadi,Textiles/Garment
PT Lucky Rejeki,Textiles/Garment
PT Lucky Sakti (Lucky Square Mall),Property/Real Estate
PT Lucky Vista Furniture,Manufacturing / Production
PT Lucolite Cemerlang,Electrical & Electronics
PT Lucrum Fajar Indonesia,"Consulting (IT, Science, Engineering & Technical)"
PT Ludira Sarana Utama,Hotel/Hospitality
PT Lugata Karya Teknik,Manufacturing/Production
PT Luhai Industrial,Manufacturing/Production
PT LUHRIBU NAGA JAYA,Construction/Building/Engineering
PT Luhur Wekasane,General & Wholesale Trading
PT Lui Swiss Indonesia,Grooming/Beauty/Fitness
PT LUKE MEDIKAL INTERNASIONAL,Insurance
PT Lukie Works Indonesia,Manufacturing/Production
PT Lukman Kharisma Buana,Transportation / Logistics
PT Lulu Indonusa,Manufacturing/Production
PT Lumajang Resources Sejahtera,Mining
PT Lumba lumba Tour & Travel,Travel/Tourism
PT Lumbung Artanugraha,Property/Real Estate
PT Lumbung Kencana Sakti,Property/Real Estate
PT Lumbung Mineral Sentosa,Mining
PT Lumbung Multi Usaha,Electrical & Electronics
PT Lumbung Nasional Flour Mill,General & Wholesale Trading
PT Lumbung Padi Indonesia,Agricultural / Plantation / Poultry / Fisheries
PT Lumbung Raya Teknologi,Computer/Information Technology (Software)
PT Lumenindo Gilang Cahaya,Others
PT Lumiga Indah Selaras,Textiles / Garment
PT Lumina Citra Perkasa,General & Wholesale Trading
PT Lumina Imaging Solusindo,Others
PT Lumina Royal Eterna,Retail/Merchandise
PT Luminary Auto Prima,Automobile/Automotive Ancillary/Vehicle
PT Luminary Group,Automobile/Automotive Ancillary/Vehicle
PT Lumindo Lestari,Electrical & Electronics
PT Luminia Jaya Internasional,Electrical & Electronics
PT Luminov Global Indonesia (LumiOne),Computer/Information Technology (Software)
PT Lumintas Puspindo,Manufacturing/Production
PT Lumintu Kencana Jasa,Consulting (Business & Management)
PT Lumonata,Computer/Information Technology (Software)
PT Lumut Mas Interindo,Accounting/Audit/Tax Services
PT Luna Negra Bali,Food & Beverage/Catering/Restaurant
PT Lunar Chemplast,Electrical & Electronics
PT Lunatik Motor Indo,Automobile/Automotive Ancillary/Vehicle
PT Lundin Industry Invest,Manufacturing / Production
PT LundinIndustry,Transportation/Logistics
PT Lung Cheong Brothers Industrial,Manufacturing/Production
PT Lung Makmur Abadi,Architectural Services / Interior Designing
PT Lungfa Jaya Abadi,Polymer/Plastic/Rubber/Tyres
PT Lungga Mahasurya,Transportation/Logistics
PT Lunto Prima Megah,General & Wholesale Trading
PT Lupeg Sejahtera Indonesia,Construction / Building / Engineering
PT Lusaga Traindo ( Lusaga Training & Consulting),Consulting (Business & Management)
PT Lusipara Rejeki,Hotel / Hospitality
PT Lussa Teknologi Global,Computer/Information Technology (Software)
PT Luvazendo Berkat Lestari,Grooming/Beauty/Fitness
PT Luvin Indonusa,Consumer Products / FMCG
PT Luvitasindo (Louis Vuitton),Retail / Merchandise
PT Luwak Management & Services,Hotel / Hospitality
PT Luwes Inovasi Mandiri (Depok),Manufacturing/Production
PT Lux Grup Indonesia,Others
PT Luxasia Indonesia,Retail/Merchandise
PT Luxchem Indonesia,General & Wholesale Trading
PT Luxe Bintang Cosmetika,General & Wholesale Trading
PT Luxell Medikal Indonesia,Healthcare/Medical
PT Luxen Makmur Sejahtera,Accounting/Audit/Tax Services
PT Luxindo Madya Pratama,Manufacturing / Production
PT Luxindo Nusantara Semarang,Manufacturing / Production
PT Luxindo Perkasa,Architectural Services/Interior Designing
PT Luxindo Raya (Bangka Belitung),General & Wholesale Trading
PT Luxindo Raya (Makassar),Retail / Merchandise
PT Luxola (Sephora Digital Division),Retail/Merchandise
PT Luxor Indonesia,Retail/Merchandise
PT Luxury Bali Villas,Hotel/Hospitality
PT LV Logistics Indonesia,Manufacturing / Production
PT LV Logistics Indonesia ( Riau ),Transportation/Logistics
PT LV Logistics Indonesia (Jakarta ),Transportation/Logistics
PT LVD Induction Indonesia,Electrical & Electronics
PT Lviors Jaya Sentosa,Grooming / Beauty / Fitness
PT Lydia Sola Gracia,Textiles / Garment
PT Lyhock Batavia Plastic Persada,Polymer/Plastic/Rubber/Tyres
PT LYKE eServices Indonesia,Computer/Information Technology (Software)
PT Lyman Investindo,Construction/Building/Engineering
"PT Lynas Medikal (Cibubur, Bekasi)",Healthcare/Medical
PT Lynea Primisima,Consumer Products/FMCG
PT Lyto Datarindo Fortuna,Entertainment/Media
PT M & N Indonesia,Manufacturing/Production
PT M & S Apparel,Textiles/Garment
PT M Cashback Indonesia,Computer / Information Technology (Software)
PT M Class Industry,Manufacturing / Production
PT M One Hotel Wisata Sukses,Hotel/Hospitality
PT M Tech Solusindo,Telecommunication
PT M+R Forwarding Indonesia,Transportation/Logistics
PT M-150 Indonesia,Consumer Products / FMCG
PT M-Plan Indonesia,Others
PT M3 Ketapang Sejahtera,Others
PT Maasai Corporindo,Textiles / Garment
PT Mabua Harley-Davidson (Surabaya),Automobile / Automotive Ancillary / Vehicle
PT Mabuchi Indonesia,Manufacturing / Production
PT Mac Sarana Djaya,Telecommunication
PT Macanan Jaya Cemerlang,Printing/Publishing
PT Macbramindo Harum Abadi,Manufacturing/Production
PT Maccaferri Indonesia,Construction / Building / Engineering
PT Maccaroni,Food & Beverage / Catering / Restaurant
PT Maccini Raya Perkasa,Construction / Building / Engineering
PT Maccon Generasi Mandiri,Manufacturing/Production
PT MACF Ambarawa,Others
PT Machindo Inti Cemerlang,Heavy Industrial/Machinery/Equipment
PT Machindotama Abadi,Heavy Industrial/Machinery/Equipment
PT Macika Mineral Industri,Manufacturing/Production
PT Macindo Riski Makmur,General & Wholesale Trading
PT Macindo Swadesi,General & Wholesale Trading
PT Mackessen Indonesia,General & Wholesale Trading
PT Macnels Express Pratama (Bali Office),Transportation / Logistics
PT Macnels Express Pratama (Jkt Office),Consumer Products / FMCG
PT Macoline Indonesia,Transportation / Logistics
PT Macro Jaya Agung,Others
PT Macro Petro Energy,Oil/Gas/Petroleum
PT Macrocitra Ardanasejati,Healthcare/Medical
PT Macrocitra Multicheck,General & Wholesale Trading
PT Macrology Indonesia,"Consulting (IT, Science, Engineering & Technical)"
PT Macroprima Panganutama,Food & Beverage/Catering/Restaurant
PT Macroy Busana Sentosa (Chic Girl),Textiles/Garment
PT MACSK Living Indonesia,Retail/Merchandise
PT Mactex Bulk Material Handling,General & Wholesale Trading
PT Mad Peanuts,Computer / Information Technology (Software)
PT Mada Putra Perkasa,Chemical/Fertilizers/Pesticides
PT Madani Intelsysdata,Advertising / Marketing / Promotion / PR
PT Madani Investama,Hotel/Hospitality
PT Madani Karsa Mandiri,Banking / Financial Services
PT Madani Kencana Makmur,Manufacturing / Production
PT Madani Sandang Prima,Textiles/Garment
PT Madani Sisfotel,Advertising/Marketing/Promotion/PR
PT Made Cahaya,Others
PT Made Chahaya ( Lily Jean ),Manufacturing/Production
PT Made Tepung Pisang,Food & Beverage/Catering/Restaurant
PT Madei,Manufacturing/Production
PT Madesa Sejahtera Utama,BioTechnology/Pharmaceutical/Clinical research
PT Madhani Talatah Nusantara,Mining
PT Madhucon Indonesia,Mining
PT Madhucon Sriwijaya Power,Mining
PT MADI PUTRA,General & Wholesale Trading
PT Madika Travelindo,Travel / Tourism
PT Madinah Indah Wisata,Travel/Tourism
PT Madison Angsa Sejahtera,Hotel/Hospitality
PT Madison Mahacipta,Arts/Design/Fashion
PT Maditech Medika Farma,Healthcare / Medical
PT Madnine Digital,"Consulting (IT, Science, Engineering & Technical)"
PT Madonna Varia Kreasi,Retail/Merchandise
PT Madonna Variakreasi,Retail / Merchandise
PT Madu Fertra,Food & Beverage / Catering / Restaurant
PT Madu Jaya Indoprima,Manufacturing/Production
PT Madu Lingga Raharja,Chemical/Fertilizers/Pesticides
PT Madu Manis Makmur (Semarang),Manufacturing/Production
PT Madu Murni Nusantara ( Medan ),Manufacturing / Production
PT Madu Murni Nusantara (Jakarta),Food & Beverage/Catering/Restaurant
PT Madu Murni Nusantara (Solo),Consumer Products/FMCG
PT Maduroo Internasional,"Consulting (IT, Science, Engineering & Technical)"
PT Maduroo International,Computer/Information Technology (Software)
PT Madusari Mas,Human Resources Management/Consulting
PT Madusari Murni Indah,BioTechnology/Pharmaceutical/Clinical research
PT Madusari Nusaperdana,Consumer Products/FMCG
PT Madya Putera Tehnik,Manufacturing/Production
PT Madya Utama Expresindo,Manufacturing/Production
PT Madyakreasi Perdana,Architectural Services/Interior Designing
PT MAE Logistics P&J,Transportation / Logistics
PT Maersk Line,Transportation / Logistics
PT Maes Electronic (Bali),Electrical & Electronics
PT Maesa Bersama (Star Safety),Oil/Gas/Petroleum
PT Maesindo Indonesia,Manufacturing/Production
PT Maestro Consulting Coaching Sharing,Consulting (Business & Management)
PT Maestro Global Informatika,Computer/Information Technology (Software)
PT Maestro Mitra Korpora,Consulting (Business & Management)
PT Maestro Nusantara Prima,Computer / Information Technology (Hardware)
PT Maestro Pendidikan Indonesia,Education
PT Mafan Samudra Jaya,Others
PT Mafi Jaya Indonesia,Architectural Services / Interior Designing
PT Maga Putra Mandiri (Maga Swalayan),Retail/Merchandise
PT Magdatama Multi Usaha,Construction / Building / Engineering
PT Magelang Putra Jaya Motor,Automobile / Automotive Ancillary / Vehicle
PT Magenta Biomedika,Environment / Health / Safety
PT Magenta Mediatama,Printing/Publishing
PT Magenta Teknologi,Electrical & Electronics
PT Magfood Inovasi Pangan,Food & Beverage/Catering/Restaurant
PT MagFood Inovasi Pangan,Food & Beverage/Catering/Restaurant
PT Magg Bali Asia,Textiles / Garment
PT Maggio Makmur Sejahtera,Retail/Merchandise
PT Maggiollini Indonesia,Architectural Services/Interior Designing
PT Magic Com Indonesia (Yong Ma),Electrical & Electronics
PT Magic Indonesia International,Healthcare/Medical
PT Magicsoft Asia Systems,Computer/Information Technology (Software)
PT Maginet Indonesia,Computer/Information Technology (Hardware)
PT Magna Bumi Group,Manufacturing/Production
PT Magna Business Support,Consulting (Business & Management)
PT Magna Finance Tbk,Banking/Financial Services
PT Magna Furniture,Architectural Services/Interior Designing
PT Magna Guna Karsa,Construction/Building/Engineering
PT Magna Hardware,General & Wholesale Trading
PT Magna Indonesia,Chemical/Fertilizers/Pesticides
PT Magna Industry And Tyres,Heavy Industrial/Machinery/Equipment
PT Magna Network,"Consulting (IT, Science, Engineering & Technical)"
PT Magna Perkasa,Chemical / Fertilizers / Pesticides
PT Magna Sardo,Healthcare/Medical
PT Magna Sardo(Surabaya),BioTechnology / Pharmaceutical / Clinical research
PT Magna Solusi Indonesia,"Consulting (IT, Science, Engineering & Technical)"
PT Magna Solusi Informatika,Computer/Information Technology (Software)
PT Magna Talenta Prima,Consulting (Business & Management)
PT Magna Transforma Utama,Consulting (Business & Management)
PT Magna Visi Indonesia,Advertising/Marketing/Promotion/PR
PT Magnakabel Nusantara,Electrical & Electronics
PT Magnetic,Healthcare / Medical
PT Magnetic Mitra Adijaya,Human Resources Management / Consulting
PT Magnetik Mitra Adijaya,Human Resources Management / Consulting
PT Magnetik Mitra Adijaya (Medan),Human Resources Management / Consulting
PT Magnetik Mitra Adijaya (Surabaya),Human Resources Management / Consulting
PT Magnifika Dhana Aksata,Advertising/Marketing/Promotion/PR
PT Magno Inovasi Teknologi,"Consulting (IT, Science, Engineering & Technical)"
PT Magnum Mitra Prima,Food & Beverage / Catering / Restaurant
PT Magnus Angulus,Travel/Tourism
PT Magnus Cipta Estetika,Consumer Products/FMCG
PT MAGNUS DIGITAL INDONESIA,Computer/Information Technology (Software)
PT Mago Indosehat,Healthcare/Medical
PT Mago Makmur,Retail / Merchandise
PT Magtus Manajemen Investama,Banking / Financial Services
PT Magwei Indonesia,Printing/Publishing
PT Mah Sing Indonesia,Manufacturing/Production
PT Maha Gaya Inovasi,Food & Beverage/Catering/Restaurant
PT Maha Global Persada,Heavy Industrial / Machinery / Equipment
PT Maha Global Persada Indonesia,Manufacturing / Production
PT Maha Green,Transportation / Logistics
PT Maha Jaya Plastindo Indonesia,Manufacturing/Production
PT Maha Kimia Indonesia,Chemical/Fertilizers/Pesticides
PT Maha Kreasi Artistik,Architectural Services/Interior Designing
PT Maha Kreasi Indonesia,Exhibitions/Event management/MICE
PT Maha Mitra Sejati,Human Resources Management/Consulting
PT Maha Mitra Sejati,Consulting (Business & Management)
PT Maha Multi Kreasi,Retail/Merchandise
PT Maha Padda Lestari,Retail/Merchandise
PT Maha Putera Fatih,Heavy Industrial / Machinery / Equipment
PT Maha Rani Raya,Manufacturing/Production
PT Maha Sentral Sejati Cabang Purwokerto,Human Resources Management / Consulting
PT Maha Tirta Utama,General & Wholesale Trading
PT Mahabharata Eka Paksi,General & Wholesale Trading
PT Mahadana Dasha Utama,Others
PT MAHADANA GROUP,Others
PT Mahadaya Cipta Imaji (MCI Advertising),Advertising/Marketing/Promotion/PR
PT Mahadaya Global,Manufacturing/Production
PT Mahadaya Karya Mandiri (jakarta),Human Resources Management / Consulting
PT Mahadaya Komunika (Ipower Communications),Accounting / Audit / Tax Services
PT Mahadepa Abadi,Architectural Services/Interior Designing
PT Mahadhika Permata Wijaya (CROWN PRINCE Hotel Surabaya),Hotel / Hospitality
PT Mahadip Putera Sejahtera ( Kelapa Gading ),Food & Beverage/Catering/Restaurant
PT Mahadip Putra Sejahtera,Food & Beverage/Catering/Restaurant
PT Mahaghora,Manufacturing/Production
PT Mahagiri,Hotel/Hospitality
PT Mahagra Adhi Karya,Others
PT Mahajaya Karya,Retail/Merchandise
PT Mahajaya Putra Dewata,Agricultural/Plantation/Poultry/Fisheries
PT Mahaka Media Tbk,Advertising/Marketing/Promotion/PR
PT Mahakam Ekagraha (Mahakam Group),Hotel/Hospitality
PT Mahakam Indosonic,Healthcare / Medical
PT Mahakam Kencana Intan Padi (Lampung),Consulting (Business & Management)
PT MAHAKAM KENCANA INTAN PADI BANDUNG,Others
PT Mahakam Prima Akbar Sejati,Mining
PT Mahakarya Agung Putera,Property/Real Estate
PT Mahakarya Anak Nusantara,Accounting/Audit/Tax Services
PT Mahakarya Berlima Digital,Computer / Information Technology (Hardware)
PT Mahakarya Geo Survey,Oil/Gas/Petroleum
PT Mahakarya Kapital,Consumer Products/FMCG
PT Mahakarya Master Genetika,Healthcare/Medical
PT Mahakarya Multi Cemerlang,General & Wholesale Trading
PT Mahakarya Pratama Medika,Healthcare/Medical
PT Mahakarya Putra Indonesia,Manufacturing / Production
PT Mahakarya Reka Prima,Consulting (Business & Management)
PT Mahakarya Sakti Suplindo,General & Wholesale Trading
PT Mahakarya Sentra Agregat,General & Wholesale Trading
PT Mahakarya Sentra Nabati,Manufacturing/Production
PT Mahakarya Tunggal Abadi,Construction/Building/Engineering
PT Mahakarya Warisan Nusantara,Retail/Merchandise
PT Mahakarya Warisan Nusantara,Retail/Merchandise
PT Mahala Langgeng Abadi,Property/Real Estate
Pt Mahalaya Agri Corp,Retail/Merchandise
PT Mahameru Centratama Spinning,Textiles/Garment
PT Mahameru Mitra Makmur,Transportation/Logistics
PT Mahameru Perkasa,Manufacturing / Production
PT Mahameru Production,Exhibitions/Event management/MICE
PT Mahanusa Hijau Selaras,Agricultural/Plantation/Poultry/Fisheries
PT Mahanysa Banindo,Manufacturing / Production
PT Mahapala Mahardhika,Entertainment/Media
PT Mahaputra Adi Nusa,Oil / Gas / Petroleum
PT Mahaputra Prasadhana,Manufacturing / Production
PT Maharaja Pusaka Nusantara,Food & Beverage / Catering / Restaurant
PT Maharani Samudera Caraka,Transportation/Logistics
PT Maharasa Jaya Abadi,Food & Beverage/Catering/Restaurant
PT Maharasa Nusantara Gemilang,Food & Beverage/Catering/Restaurant
PT Mahardhika Cipta Nusa,General & Wholesale Trading
PT MAHARDHIKA PROPERTINDO,Property/Real Estate
PT Mahardika Agung Lestari,Property/Real Estate
PT Maharta,Arts / Design / Fashion
PT Maharupa Gatra,Retail/Merchandise
PT Mahawira Jaya Pratama,Retail / Merchandise
PT Mahawira Putra Teknik,Construction/Building/Engineering
PT Mahawirya Makmur Sentosa,Manufacturing/Production
PT Mahensa,Electrical & Electronics
PT Mahesa Anugrah Jingga,General & Wholesale Trading
PT Mahesa Artha Jaya,Heavy Industrial/Machinery/Equipment
PT Mahesa Cakra Buana,Human Resources Management / Consulting
PT Mahesa Ratu,Construction/Building/Engineering
PT Mahesa Seluler Raya,Telecommunication
PT Mahika Tirta,Property/Real Estate
PT Mahir Karya Setya,Construction/Building/Engineering
PT Mahisa Pratama Abadi,Consulting (Business & Management)
PT Mahita Karya Persada Teknik,"Consulting (IT, Science, Engineering & Technical)"
PT MAHIZA KARYA MANDIRI,Electrical & Electronics
PT Mahkota Buana Mandiri,Manufacturing/Production
PT Mahkota Elang Internusa,General & Wholesale Trading
PT Mahkota Gemilang Airindo,General & Wholesale Trading
PT Mahkota Healthcare Services,Healthcare / Medical
PT Mahkota Indotrans Logistic,Transportation / Logistics
PT Mahkota Jaya Sentosa,Retail / Merchandise
PT Mahkota Kharisma Sejahtera,Human Resources Management/Consulting
PT Mahkota Logistik Indoraya,Transportation / Logistics
PT Mahkota Mas Mandiri Mulia,Manufacturing/Production
PT Mahkota Musik Indonesia,Retail/Merchandise
PT Mahkota Ogan Sumatera,Entertainment/Media
PT Mahkota Permata Perdana,Property/Real Estate
PT Mahkota Properti Indo,Property/Real Estate
PT Mahkota Samudera Jaya,Agricultural/Plantation/Poultry/Fisheries
PT Mahkota Sejahtera Perkasa,Food & Beverage / Catering / Restaurant
PT Mahkota Sentosa,Travel / Tourism
PT Mahkotadewa Indonesia,Accounting/Audit/Tax Services
PT Mahle  Indonesia,Manufacturing/Production
PT Mahligai Puteri Berlian,Manufacturing / Production
PT Mahoni Global,Computer/Information Technology (Hardware)
PT Mahoni Global (Jawa Timur),"Consulting (IT, Science, Engineering & Technical)"
PT Mahottama Aluminium Suryagiri,Manufacturing/Production
PT Mahpati Solusindo,Computer / Information Technology (Software)
PT Maia Lintang Batari,General & Wholesale Trading
PT Maiadia Interactive,Human Resources Management/Consulting
PT Main Sukses Grup,Food & Beverage/Catering/Restaurant
PT Mainest Gaya Kreatif,Manufacturing/Production
PT Mainetti Packaging Solution,Manufacturing/Production
PT Maintama Servisindo Mandiri,Others
PT Maitland-Smith Indonesia,Manufacturing / Production
PT Maitrox Mega Jaya Indonesia,Transportation/Logistics
PT Maja Agung Elektrindo,Electrical & Electronics
PT Maja Jaya,General & Wholesale Trading
PT Majamakmur Suksesmandiri,Manufacturing / Production
PT Majapahit Astabaja,Construction/Building/Engineering
PT Majapahit Sakti,Automobile / Automotive Ancillary / Vehicle
"PT Majapahit Securities, Tbk",Stockbroking / Securities
PT Majaria Kencana sakti,Electrical & Electronics
PT Majati Furniture,Wood/Fibre/Paper
PT Majesty Auto Dinamika,Automobile/Automotive Ancillary/Vehicle
PT Majesty Auto Prima,Automobile / Automotive Ancillary / Vehicle
PT Majesty Auto World,Automobile / Automotive Ancillary / Vehicle
PT MAJU ABADI CEMERLANG,General & Wholesale Trading
PT Maju Alam Sutera,General & Wholesale Trading
PT Maju Anugerah Jaya Utama,Food & Beverage/Catering/Restaurant
PT Maju Bangunan Jaya,General & Wholesale Trading
PT Maju Banter,Others
PT Maju Bersama Cemerlang Makassar,Education
PT MAJU BERSAMA MULTITEKINDO,Heavy Industrial/Machinery/Equipment
PT Maju Bertiga Indonesia,Entertainment / Media
PT Maju Daya Unggul,Electrical & Electronics
PT Maju Daya Unggul,Electrical & Electronics
PT Maju Express Indonesia,Telecommunication
PT Maju Gemilang Balaraja,General & Wholesale Trading
PT Maju Gemilang Persada,Automobile/Automotive Ancillary/Vehicle
PT Maju Global Motor,Automobile/Automotive Ancillary/Vehicle
PT Maju Guna Jaya Lestari,Manufacturing/Production
PT Maju Ina Medika,Environment / Health / Safety
PT Maju Indah Makmur,Food & Beverage / Catering / Restaurant
PT Maju Jaya Agung Labelindo,General & Wholesale Trading
PT Maju Jaya Agung Labelindo,Printing / Publishing
PT Maju Jaya Optimal,Manufacturing/Production
PT Maju Jaya Pohon Pinang,Manufacturing / Production
PT Maju Jaya Pohon Pinang (Surabaya),Manufacturing / Production
PT Maju Jaya Sarana Grafika,Printing/Publishing
PT Maju Jaya Sarana Grafika,Printing/Publishing
PT Maju Jaya Sorowako,Consulting (Business & Management)
PT Maju Jaya Teknik,Heavy Industrial / Machinery / Equipment
PT MAJU KALIMANTAN HADAPAN,Agricultural/Plantation/Poultry/Fisheries
PT Maju Karunia Lestari,Manufacturing/Production
PT Maju Kita Bersama,Oil/Gas/Petroleum
PT Maju Langgeng Mandiri,Construction / Building / Engineering
PT Maju Makmur Utomo,Manufacturing/Production
PT Maju Mandiri Utama,Oil / Gas / Petroleum
PT Maju Mitra Kerja,Others
PT Maju Mix Bersama Abadi,Manufacturing/Production
PT Maju Motor,Automobile/Automotive Ancillary/Vehicle
PT Maju Santosa Cemerlang,Property/Real Estate
PT Maju Sejahtera,General & Wholesale Trading
PT Maju Sejahtera Abadi,Accounting/Audit/Tax Services
PT Majubersama Surya Indah Motor,Automobile/Automotive Ancillary/Vehicle
PT Majubhakti Prasindo,Manufacturing/Production
PT Majuel Moulding Bra,Manufacturing / Production
PT Majuel Trading,Textiles / Garment
PT Majujaya Pohon Pinang (Medan),Food & Beverage / Catering / Restaurant
PT Majujaya Pohon Pinang Surabaya,Manufacturing / Production
PT Majulah Group,Gems/Jewellery
PT Majumapan Bangunindo,Construction / Building / Engineering
PT Majuvia Kreasi Advertindo,Advertising/Marketing/Promotion/PR
PT Makadata,Retail/Merchandise
PT Makale Toraja Mining,Mining
PT Makalot Industrial Indonesia,Textiles / Garment
PT Makan Dan Minum Aja,Food & Beverage/Catering/Restaurant
PT Makan Enak Bersama,Food & Beverage/Catering/Restaurant
PT Makan Minum Indonesia,Food & Beverage/Catering/Restaurant
PT Makanan Sehat Nusantara,Food & Beverage / Catering / Restaurant
PT Makara Nusantara,Education
PT Makara Wisata Indonesia,Travel/Tourism
PT MAKARIM INTI MAKMUR,Education
PT Makasar Indah Manna Lestari,Consumer Products/FMCG
PT Makasar Mega Putra,Property / Real Estate
PT Makassar Global Awal Bros,Healthcare / Medical
PT Makassar Indah Manna Lestari,Food & Beverage/Catering/Restaurant
PT Makassar Indomedia Group,Advertising/Marketing/Promotion/PR
PT Makassar Jaya Samudera,Transportation/Logistics
PT Makassar LintasVisual Cemerlang,Telecommunication
PT Makassar Megaprima,Manufacturing / Production
PT Makassar Rezky,Manufacturing/Production
PT Makassar Tene,Manufacturing / Production
PT Makassar Tene (Makassar),General & Wholesale Trading
PT MAKASSAR TRACTOR ADITAMA,Heavy Industrial/Machinery/Equipment
PT Make Great Things Happen International (MGTH),"Consulting (IT, Science, Engineering & Technical)"
PT Makeus Asia Indonesia,Entertainment/Media
PT Makino Indonesia,Heavy Industrial/Machinery/Equipment
PT Makki Makki Branding Consultant,Consulting (Business & Management)
PT Makmur Andal Bersama,General & Wholesale Trading
PT Makmur Artha Cemerlang,Manufacturing/Production
PT Makmur Artha Sejahtera,Manufacturing / Production
PT Makmur Berkah Amanda,Property/Real Estate
PT Makmur Berkat Unggul,Automobile / Automotive Ancillary / Vehicle
PT Makmur Cipta Sejahtera,General & Wholesale Trading
PT Makmur Djaya Sentosa,Manufacturing / Production
PT Makmur Fantawijaya Chemical Industries,Chemical/Fertilizers/Pesticides
PT Makmur Ganda Lestari,Manufacturing / Production
PT Makmur Group,Manufacturing/Production
PT Makmur Inti Energi,Oil/Gas/Petroleum
PT Makmur Inti Manajemen,Consulting (Business & Management)
PT Makmur Jaya Indonesia,Textiles/Garment
PT Makmur Jaya Kencana Cemerlang,Semiconductor/Wafer Fabrication
PT Makmur Jaya Saputra Perkasa,Manufacturing / Production
PT Makmur Jaya Usaha,Wood/Fibre/Paper
PT Makmur Konstruksi Indonesia,Others
PT Makmur Langgeng Abadi,Manufacturing / Production
PT Makmur Meta Graha Dinamika,General & Wholesale Trading
PT Makmur Mitra Gemilang,Construction/Building/Engineering
PT Makmur Multy Mega Mandiri,Construction/Building/Engineering
PT Makmur Prima Amanda,Manufacturing / Production
PT Makmur Putra Konutara,Mining
PT Makmur Sejahtera Mesindo,Heavy Industrial/Machinery/Equipment
PT Makmur Sejahtera Wisesa,Mining
PT Makmur Sistimindo Perkasa,Construction/Building/Engineering
PT Makmur Supra Nusantara,General & Wholesale Trading
PT Makmur Utama Kencana,General & Wholesale Trading
PT MAKRO ALPHA SOLUSINDO,"Consulting (IT, Science, Engineering & Technical)"
PT Makro Jaya,General & Wholesale Trading
PT Makro Pesona Wisata,Travel/Tourism
PT Makro Rekat Sekawan,Manufacturing/Production
PT Makro Rekat Sekawan,Manufacturing / Production
PT Makro Sentral Perdana,Telecommunication
PT Makrohard,Electrical & Electronics
PT Maksima Karya Sakti,Food & Beverage / Catering / Restaurant
PT Maksimedia Satyamitra,Consulting (Business & Management)
PT Maksimum Grup Indonesia,Computer/Information Technology (Software)
PT Maksimum Jaya Perkasa,Healthcare/Medical
PT Maksimum Jaya Segar,Computer / Information Technology (Software)
PT Maktrans Nusa Indah,Transportation / Logistics
