Perusahaan,Sektor
PT NK Jewelry,Gems / Jewellery
PT NL Industrial Indonesia,Heavy Industrial/Machinery/Equipment
PT NLL Kapital Asia,Banking/Financial Services
PT NNA Indonesia,Entertainment/Media
PT NNE Pharmaplan,BioTechnology / Pharmaceutical / Clinical research
PT NNR RPX Global Logistics Indonesia,Transportation/Logistics
PT NNR RPX Global Logistics Indonesia (Surabaya),Transportation/Logistics
PT No.1 Office Machinery,Retail / Merchandise
PT Noah Arkindo,Retail/Merchandise
PT Noah Health Indonesia,General & Wholesale Trading
PT Noah Logistik Indonesia,Transportation/Logistics
PT NoanBeri Batam,Food & Beverage/Catering/Restaurant
PT Nobel Industries,Retail/Merchandise
PT Nobel Packaging Indonesia,Polymer / Plastic / Rubber / Tyres
PT Nobel Technotronics,Manufacturing / Production
PT Nobelindo,Manufacturing / Production
PT Nobi Putra Angkasa,Construction/Building/Engineering
PT Noble Denton Utama,Construction/Building/Engineering
PT Noble Success International,Grooming / Beauty / Fitness
PT Noboru Tirta Lestari,Retail/Merchandise
PT Nobu Indonesia,Food & Beverage/Catering/Restaurant
PT Noci Lighting Solutions (Jakarta),Heavy Industrial/Machinery/Equipment
PT Nodeflux Teknologi Indonesia,Computer/Information Technology (Software)
PT Noer Yani,Manufacturing / Production
PT NOF Mas Chemical Industries,Chemical / Fertilizers / Pesticides
PT Nogopatmolo,Transportation/Logistics
PT Nohara Alta Indonesia,Construction/Building/Engineering
PT Nok Asia Batam,Manufacturing / Production
PT NOK Indonesia,Manufacturing/Production
PT NOK Precision Component Batam,Manufacturing / Production
PT Nokita Inti Kreasi,Advertising/Marketing/Promotion/PR
PT Nolimax Jaya,Construction / Building / Engineering
PT Nolkesatu Hita Aksata,Human Resources Management/Consulting
PT Nomura Exporindo,Textiles / Garment
PT Nomura Research Institute Indonesia,"Consulting (IT, Science, Engineering & Technical)"
PT Nomz Kulinari Makmur,Food & Beverage/Catering/Restaurant
PT Non Ferindo Utama,Manufacturing / Production
PT Nongsa Jaya Buana,Heavy Industrial/Machinery/Equipment
PT Nongsa Point Marina,Hotel / Hospitality
PT Nongsa Terminal Bahari,Marine/Aquaculture
PT Noorel Idea,Consulting (Business & Management)
PT Noosc Global,"Consulting (IT, Science, Engineering & Technical)"
PT Nopest Indonesia,Chemical / Fertilizers / Pesticides
PT Norato Sejahtera Abadi,Accounting/Audit/Tax Services
PT NORD Indonesia,Automobile/Automotive Ancillary/Vehicle
PT Norenda Agung,Retail / Merchandise
PT Norgen Healthcare Indonesia,Healthcare/Medical
PT Norita Flexindo,Manufacturing / Production
PT Noritake Indonesia,Manufacturing / Production
PT Norlec Technology,Telecommunication
PT Norlec Telekomunikasi Indonesia,Telecommunication
PT Normet Indonesia,Heavy Industrial/Machinery/Equipment
PT North Sumatera Hydro Energy,Electrical & Electronics
PT North West Indonesia,General & Wholesale Trading
PT Northern Bulk Indonesia,Others
PT Northern Star Energy,Oil/Gas/Petroleum
PT Northindo Cipta Kreatif,Arts/Design/Fashion
PT Northwest Dinamikaraya Power,Electrical & Electronics
PT NOSE HERBALINDO,Consumer Products/FMCG
PT Nova Chemie Utama,BioTechnology/Pharmaceutical/Clinical research
PT Nova Indonesia,Architectural Services/Interior Designing
PT Novamex Indonesia (Acter Group),Construction/Building/Engineering
PT Novaon Indonesia,Advertising/Marketing/Promotion/PR
PT Novapharin,BioTechnology/Pharmaceutical/Clinical research
PT Novartis Indonesia,BioTechnology / Pharmaceutical / Clinical research
PT Novelite Indonesia,Computer/Information Technology (Software)
PT Novell Pharmaceutical Lab,Others
PT Novell Pharmaceutical Laboratories,BioTechnology/Pharmaceutical/Clinical research
PT Novena Anugrah Lestari (Novena Cargo),Transportation / Logistics
PT NOVENA GLOBAL SOLUSI,Construction/Building/Engineering
PT Novindo Anugrah Perkasa,Construction / Building / Engineering
PT Novinet,Others
PT Novo Complast Indonesia,Polymer/Plastic/Rubber/Tyres
PT Novo Nordisk Indonesia,BioTechnology/Pharmaceutical/Clinical research
PT Novus Gawana Resort & Spa,Hotel / Hospitality
PT Novus Prodamax Solutions,General & Wholesale Trading
PT Novus Solusi Integrasi,"Consulting (IT, Science, Engineering & Technical)"
PT NOW Indonesia,General & Wholesale Trading
PT NOWRUPIAH SERVICES TECHONOLOGY,Banking/Financial Services
PT Noxindo Cakrawala,Electrical & Electronics
PT Nozomi Otomotif Indonesia,Automobile/Automotive Ancillary/Vehicle
PT NP Artindo,Advertising / Marketing / Promotion / PR
PT NP Auto Refinishes Indonesia,Automobile/Automotive Ancillary/Vehicle
PT NP Auto Refinishes Indonesia,General & Wholesale Trading
PT NP Foods Indonesia,Consumer Products/FMCG
PT NP International,Transportation/Logistics
PT NPD Solutions Indonesia,Consulting (Business & Management)
PT NR Electric Jakarta,Manufacturing / Production
PT NRI Global Mandiri,Retail/Merchandise
PT NRP,Property/Real Estate
PT NRZ Prima Gasket,Automobile/Automotive Ancillary/Vehicle
PT NS Bluescope Lysaght Indonesia,Heavy Industrial/Machinery/Equipment
PT NS BlueScope Lysaght Indonesia,Heavy Industrial / Machinery / Equipment
PT NSC Finance (Bangli),Banking / Financial Services
PT NSC FInance (Bontang),Banking / Financial Services
PT NSC Finance (Semarang),Banking / Financial Services
PT NSearch Global Indonesia,Consulting (Business & Management)
PT NSK Bearings Manufacturing Indonesia,Manufacturing/Production
PT NSK Indonesia,Manufacturing/Production
PT NSP Technology Batam,Manufacturing/Production
PT Nssol Systems Indonesia,"Consulting (IT, Science, Engineering & Technical)"
PT NT Indonesia,Manufacturing / Production
PT NT Piston Ring Indonesia,Manufacturing/Production
PT NTG INDONESIA,General & Wholesale Trading
PT NTL Naigai Trans Line Indonesia,Transportation / Logistics
PT NTT Data Indonesia,Computer/Information Technology (Software)
PT NTT Indonesia,Telecommunication
PT NTT Indonesia Nexcenter,Computer/Information Technology (Software)
PT Nuansa Bali Anyer,Hotel / Hospitality
PT Nuansa Boga Sejahtera,Food & Beverage / Catering / Restaurant
PT Nuansa Ceria Pesona,Travel/Tourism
PT NUANSA HIJAU ALAMI,Property/Real Estate
PT Nuansa Hijau Lestari,Property/Real Estate
PT Nuansa Karya Persada,Construction/Building/Engineering
PT Nuansa Media,Entertainment/Media
PT Nuansa Sakti Kencana,Mining
PT Nuansa Timur Lestari,Architectural Services / Interior Designing
PT Nuansa Vadita Prima,Retail/Merchandise
PT Nuansacipta Coal Investment,Mining
PT Nuclear Coating Fabric,Manufacturing/Production
PT NUCLEUS ENGINEERS & SUPPLIERS,Construction / Building / Engineering
PT Nucleus Nusacitra Utama,Retail / Merchandise
PT Nudira Sumber Daya Indonesia,Manufacturing/Production
PT Nuesto Teknologi Indonesia,Computer/Information Technology (Software)
PT Nufarindo,Healthcare / Medical
PT Nufarm Indonesia,Chemical/Fertilizers/Pesticides
PT Nuge Tate Abadi,Exhibitions/Event management/MICE
PT Nugerah Surya Indonesia (Laundry White Express),Others
PT NuGlobe Solutions,Consulting (Business & Management)
PT Nugra Santana,Others
PT Nugraha Fancy Plywood,Wood/Fibre/Paper
PT Nugraha Indah International Indonesia,Travel/Tourism
PT Nugraha Karya Oshinda,Computer / Information Technology (Software)
PT Nugraha Siti Kumala,General & Wholesale Trading
PT Nugroho Konstruksi,Construction / Building / Engineering
PT Nugroho Lestari,Construction/Building/Engineering
PT Nukleus Indonesia,"Consulting (IT, Science, Engineering & Technical)"
PT Nukote Indonesia,General & Wholesale Trading
PT Number One.,"Consulting (IT, Science, Engineering & Technical)"
PT Nun Indonesia Persada,Mining
PT Nunukan Sawit Mas,Heavy Industrial/Machinery/Equipment
PT Nur Ala Nur Tour & Travel,"Consulting (IT, Science, Engineering & Technical)"
PT Nur Ashabul Perkasa,Manufacturing/Production
PT Nur Dewata,Travel/Tourism
PT Nur Elang Persada,Human Resources Management / Consulting
PT Nur Ipek Indonesia,Retail/Merchandise
PT Nuraiti Tjermin,Property/Real Estate
PT Nurani Ikrar Dharma Utama,Hotel / Hospitality
PT Nurasa Sinar Utama,Food & Beverage/Catering/Restaurant
PT Nurco Aruna Mitra,Electrical & Electronics
PT Nureco Resources,Advertising / Marketing / Promotion / PR
PT Nureka Bintang Abadi,Accounting/Audit/Tax Services
PT Nureka Bintang Abadi PT,Architectural Services/Interior Designing
PT Nuren Samijaya,Computer / Information Technology (Software)
PT Nurinda,Gems / Jewellery
PT Nurindo Logistics,Transportation/Logistics
PT Nurman Mitra sentosa,Manufacturing/Production
PT Nursyad Dwi Insani,Printing / Publishing
PT Nusa Abadi Indo Global,Consulting (Business & Management)
PT Nusa Alam Rubber,General & Wholesale Trading
PT Nusa Bali Jaya,Others
PT Nusa Cakrawala Sejati (NCS Line),Transportation/Logistics
PT Nusa Cipta Rancana (Nucira Group),Property / Real Estate
PT NUSA CIPTA SOLUSI,Others
PT Nusa Citra Cakrawala,Travel/Tourism
PT Nusa Dharma Ekspresindo,Transportation/Logistics
PT Nusa Education,Education
PT Nusa Energi Sejati,Accounting/Audit/Tax Services
PT Nusa Flying International,Aerospace / Aviation / Airline
PT Nusa Halmahera Minerals,Mining
PT Nusa Hijau Persada,Construction/Building/Engineering
PT Nusa Idea Technology,Computer / Information Technology (Software)
PT Nusa Ina Leisure Indonesia Specialist,Travel / Tourism
PT Nusa Indah Alam Permai,Oil/Gas/Petroleum
PT Nusa Indah Kalimantan Plantations,Agricultural/Plantation/Poultry/Fisheries
PT Nusa Indah Metalindo,Manufacturing/Production
PT Nusa International,General & Wholesale Trading
PT Nusa Jaya Indofast,Travel / Tourism
PT Nusa Jaya Internasional,General & Wholesale Trading
PT Nusa Jaya Port,Mining
PT Nusa Karya Arindo,Mining
PT Nusa Kirana Real Estate,Property/Real Estate
PT Nusa Makmur Ventura,Banking/Financial Services
PT Nusa Mandiri Utama,Agricultural/Plantation/Poultry/Fisheries
PT Nusa Motor,Automobile / Automotive Ancillary / Vehicle
PT Nusa Multi Valas,Banking / Financial Services
PT Nusa Network Prakarsa,Computer/Information Technology (Hardware)
PT Nusa Pacific Island,Property / Real Estate
PT Nusa Pallet Mandiri,Manufacturing / Production
PT Nusa Pembangun Semesta,Accounting/Audit/Tax Services
PT Nusa Plast,Polymer / Plastic / Rubber / Tyres
PT Nusa Presi Indonesia,Manufacturing/Production
PT Nusa Prima Motor,Automobile/Automotive Ancillary/Vehicle
PT Nusa Prima Rizwari,Property/Real Estate
PT Nusa Raya Cipta (Surabaya),General & Wholesale Trading
PT Nusa Raya Cipta Bali,Construction/Building/Engineering
PT Nusa Raya Cipta Semarang,General & Wholesale Trading
PT Nusa Raya Cipta Tbk,Construction/Building/Engineering
PT Nusa Raya Cipta Yogyakarta,Construction / Building / Engineering
PT Nusa Raya Jaya Kalimantan Plantation,Agricultural / Plantation / Poultry / Fisheries
PT Nusa Santana Prima,Travel/Tourism
PT Nusa Sarana Indonesia,Chemical/Fertilizers/Pesticides
PT Nusa Sarana Indonesia (Makassar),Manufacturing/Production
PT Nusa Sastratara Utama,Printing/Publishing
PT Nusa Satu Inti Artha,Computer/Information Technology (Software)
PT Nusa Satu Inti Artha Cab Bandung,Computer / Information Technology (Software)
PT Nusa Segara Wana Lestari,Construction / Building / Engineering
PT Nusa Selaras Indonesia,Retail / Merchandise
PT Nusa Sinarindo Konstruksi,Construction/Building/Engineering
PT Nusa Surya Ciptadana,Banking / Financial Services
PT Nusa Tambang Pratama,Mining
PT Nusa Teknologi Integrasi,"Consulting (IT, Science, Engineering & Technical)"
PT Nusa Toyotetsu Corp,Automobile/Automotive Ancillary/Vehicle
PT Nusa Toyotetsu Engineering,Manufacturing/Production
PT Nusa Trans Bali,Transportation/Logistics
PT Nusa Travel Indonesia,Travel/Tourism
PT Nusa Tri Wisesa,Consulting (Business & Management)
PT Nusa Triutama,General & Wholesale Trading
PT Nusa Unggul Sarana Adi Cipta,Banking / Financial Services
PT Nusa Unggul Sarana Adicipta (Demak),General & Wholesale Trading
PT NUSA UNGGUL SARANA ADICIPTA (NUSABOARD),Construction/Building/Engineering
PT Nusa Utama Primantara,Education
PT Nusacipta Indonesia,Construction/Building/Engineering
PT Nusada Kreasifontana,General & Wholesale Trading
PT Nusadewa Natura,Hotel/Hospitality
PT Nusadua Pos,Entertainment/Media
PT NUSAE NADI INDONESIA,Consulting (Business & Management)
PT Nusagilang Idaman,Construction/Building/Engineering
PT Nusahadi Citraharmonis,Manufacturing / Production
PT Nusajaya Persadatama Mandiri,Mining
PT Nusaka Prima Sarana,Construction/Building/Engineering
PT Nusaland Development,Construction / Building / Engineering
PT Nusamandala Artha Cipta Tehnik,General & Wholesale Trading
PT Nusamandala Primadaya,Manufacturing / Production
PT Nusantara Abdi Mulia,Banking/Financial Services
PT Nusantara Alam Bahari,Marine/Aquaculture
PT Nusantara Andalas Motor (Mazda Jambi),Automobile / Automotive Ancillary / Vehicle
PT NUSANTARA BANGUN MITRAUTAMA,Construction/Building/Engineering
PT Nusantara Baskara Jaya,Computer/Information Technology (Software)
PT Nusantara Batavia Motor,Automobile / Automotive Ancillary / Vehicle
PT Nusantara Berkah Digital,Computer/Information Technology (Software)
PT Nusantara Bina Artha,Banking/Financial Services
PT Nusantara Borneo Motor - Mazda Balikpapan,Automobile / Automotive Ancillary / Vehicle
PT Nusantara Borneo Motor Cabang Palangkaraya,Automobile / Automotive Ancillary / Vehicle
PT Nusantara Building Industries,Manufacturing/Production
PT Nusantara Bulk Terminal,Transportation / Logistics
PT Nusantara Card Semesta ( Bali Branch ),Transportation/Logistics
PT Nusantara Card Semesta (NCS),Transportation / Logistics
PT Nusantara Card Semesta Semarang,Consulting (Business & Management)
PT Nusantara Cargo & Logistics,Transportation/Logistics
PT Nusantara Citra Alam Raya,Construction / Building / Engineering
PT Nusantara Citra Konsultan,Construction/Building/Engineering
PT Nusantara Citra Transporttindo,Transportation/Logistics
PT Nusantara Compnet Integrator,Computer/Information Technology (Hardware)
PT Nusantara Dian Center (NDC),Marine/Aquaculture
PT Nusantara Digital Konsultan,"Consulting (IT, Science, Engineering & Technical)"
PT Nusantara Ekahandal Electrostatic,General & Wholesale Trading
PT Nusantara Elka Sumber,General & Wholesale Trading
PT Nusantara Encephal Learning,Education
PT Nusantara Indah (Balikpapan),Automobile / Automotive Ancillary / Vehicle
PT Nusantara Indah (Banjarmasin),Automobile/Automotive Ancillary/Vehicle
PT Nusantara Indah Makmur (Surabaya),Consumer Products / FMCG
PT Nusantara Indah Makmur Surakarta,Transportation / Logistics
"PT Nusantara Infrastructure, Tbk",Banking/Financial Services
PT Nusantara Insan Cemerlang,Advertising / Marketing / Promotion / PR
PT Nusantara Insan Cemerlang (Cab. Bogor),Advertising / Marketing / Promotion / PR
PT Nusantara Jaya Ekspress,Manufacturing/Production
PT Nusantara Jaya Raya Mujur,Property/Real Estate
PT Nusantara Jaya Sentosa,Automobile/Automotive Ancillary/Vehicle
PT Nusantara Jaya Teknologi,Accounting/Audit/Tax Services
PT Nusantara Jaya Unggul,Agricultural/Plantation/Poultry/Fisheries
PT Nusantara Laju Bersama,Manufacturing/Production
PT Nusantara Makmur Sentosa,Wood / Fibre / Paper
PT NUSANTARA MEDIA BALIWANGI,Entertainment / Media
PT NUSANTARA MEDIA MANDIRI ( NUSANTARATV ),Others
PT Nusantara Multi Raharja,Manufacturing/Production
PT Nusantara Parkerizing,Manufacturing / Production
PT Nusantara Perdana Indonesia,Textiles/Garment
PT Nusantara Perkasa Solusindo,Property/Real Estate
PT Nusantara Prima Sukses Sejati,Property/Real Estate
PT NUSANTARA SAKTI CABANG BUMIAYU,Automobile/Automotive Ancillary/Vehicle
PT NUSANTARA SAKTI CABANG CILACAP,Automobile/Automotive Ancillary/Vehicle
PT NUSANTARA SAKTI CABANG DEMAK,Automobile/Automotive Ancillary/Vehicle
PT Nusantara Sakti Cabang Kartasura Sukoharjo,Automobile/Automotive Ancillary/Vehicle
PT NUSANTARA SAKTI CABANG KEBUMEN,Automobile/Automotive Ancillary/Vehicle
PT NUSANTARA SAKTI CABANG MAGELANG,Automobile/Automotive Ancillary/Vehicle
PT NUSANTARA SAKTI CABANG NGUTER,Automobile/Automotive Ancillary/Vehicle
PT NUSANTARA SAKTI CABANG PURWOREJO,Automobile/Automotive Ancillary/Vehicle
PT NUSANTARA SAKTI CABANG SALATIGA,Automobile/Automotive Ancillary/Vehicle
PT NUSANTARA SAKTI CABANG SOLO,Automobile/Automotive Ancillary/Vehicle
PT NUSANTARA SAKTI CABANG SRAGEN,Automobile/Automotive Ancillary/Vehicle
PT NUSANTARA SAKTI CABANG TEGAL,Automobile/Automotive Ancillary/Vehicle
PT Nusantara Sakti Group (Bandung),Retail / Merchandise
PT Nusantara Sakti Group (Pekalongan),Banking / Financial Services
PT Nusantara Sakti Group (Yogyakarta),General & Wholesale Trading
PT Nusantara Sakti Group(Semarang),Manufacturing/Production
PT Nusantara Sakti Honda,Automobile / Automotive Ancillary / Vehicle
PT Nusantara Sakti Propertindo,Property/Real Estate
PT Nusantara Sakti Purwokerto,Automobile/Automotive Ancillary/Vehicle
PT Nusantara Sawit Persada,Oil / Gas / Petroleum
PT Nusantara Secom Infotech,Computer / Information Technology (Software)
PT Nusantara Sehat,Retail/Merchandise
PT Nusantara Sejahtera Raya,Entertainment/Media
PT Nusantara Steelmills Indonesia,Others
PT Nusantara Sukses Pratama Mandiri,Manufacturing / Production
PT NUSANTARA SUKSES TEKNOLOGI,"Consulting (IT, Science, Engineering & Technical)"
PT Nusantara Surya Sakti ( Bandung ),General & Wholesale Trading
PT Nusantara Surya Sakti (Denpasar),Automobile/Automotive Ancillary/Vehicle
PT Nusantara Surya Sakti (Makassar),Others
PT Nusantara Surya Sakti (Malang Kota),Transportation / Logistics
PT Nusantara Surya Sakti (Yogyakarta),Automobile / Automotive Ancillary / Vehicle
PT Nusantara Tekno Indonesia,"Consulting (IT, Science, Engineering & Technical)"
PT Nusantara Trade Net,General & Wholesale Trading
PT Nusantara Training Center Indonesia,Education
PT Nusantara Traisser,Manufacturing/Production
PT Nusantara Tropical Farm,Agricultural / Plantation / Poultry / Fisheries
PT NUSANTARA TURBIN DAN PROPULSI,General & Wholesale Trading
PT Nusantara Utama Technology,Computer / Information Technology (Hardware)
PT Nusantaralestari Ceriapratama,Printing/Publishing
PT NUSANTECH,Computer/Information Technology (Software)
PT Nusapak Sejahtera Indonesia,Marine / Aquaculture
PT NUSAPANGAN SUKSES MAKMUR,Food & Beverage/Catering/Restaurant
PT Nusapasific Island Investment,Property/Real Estate
PT Nusapay Solusi Indonesia,Computer/Information Technology (Software)
PT Nusapratama Dwikharisma,Construction/Building/Engineering
PT Nusapro Telemedia Persada,Electrical & Electronics
PT Nusaraya Elok Anugrah,Oil/Gas/Petroleum
PT Nusaraya International Tour & Travel,Travel/Tourism
PT Nusaraya Lintas Indah (Nusaraya Tour & Travel),Travel/Tourism
PT Nusaraya Putramandiri,General & Wholesale Trading
PT NUSARESEARCH,R&D
PT Nusasarana Pradipta,Food & Beverage/Catering/Restaurant
PT Nusasembada Bangunindo,Property/Real Estate
PT Nusatovel,Travel/Tourism
PT Nusautama Medicalindo,Healthcare/Medical
PT Nusindoprima Indah,Heavy Industrial/Machinery/Equipment
PT Nustraco Global Investama,Oil/Gas/Petroleum
PT Nutech Dinamika Semesta,Retail / Merchandise
PT NUTECH INDUSTRIES INDONESIA,Manufacturing/Production
PT Nutech Integrasi,"Consulting (IT, Science, Engineering & Technical)"
PT Nutech Storage Solusindo,Manufacturing/Production
PT Nutraco Mesindotama,General & Wholesale Trading
PT Nutraco Pratama Indonesia,Manufacturing / Production
PT Nutragen Global Esana,General & Wholesale Trading
PT Nutrasweet Indonesia,Manufacturing / Production
PT Nutrend International,General & Wholesale Trading
PT Nutri Gizindo Nusantara,Consumer Products / FMCG
PT Nutri Pangan Indonesia,Food & Beverage/Catering/Restaurant
PT Nutri Prima Sejahtera,General & Wholesale Trading
PT Nutricia Indonesia Sejahtera,Consumer Products/FMCG
PT Nutricia Medical Nutrition,Healthcare / Medical
PT Nutriestetika Prima,BioTechnology/Pharmaceutical/Clinical research
PT Nutrifood Indonesia,Consumer Products/FMCG
PT Nutrifood Indonesia,Food & Beverage / Catering / Restaurant
PT Nutrifood Indonesia (Bali),Consumer Products / FMCG
PT Nutrilab Pratama,BioTechnology/Pharmaceutical/Clinical research
PT Nutrindo Grahahusada Utama,Consumer Products / FMCG
PT Nutrisi Selera Asia,General & Wholesale Trading
PT Nutritional food and catering,Food & Beverage/Catering/Restaurant
PT NUU Mobile Indonesia,Telecommunication
PT Nuur Hadi Insana,Human Resources Management/Consulting
PT Nuurindah Semesta,Hotel / Hospitality
PT Nuurindah Semesta (Haery 1 Group),Property / Real Estate
PT Nuvita Putra Pratama,Consulting (Business & Management)
PT Nuvolatama Mega Informasi,Computer/Information Technology (Software)
PT Nuvos Solusindo,Consumer Products / FMCG
PT NVC Lighting Technology Sea,General & Wholesale Trading
PT NVision Indonesia,Telecommunication
PT NW Industries,Heavy Industrial / Machinery / Equipment
PT NXI,Printing/Publishing
PT NXST ARCHITECTS PLANNERS,Architectural Services/Interior Designing
PT NYK Line Indonesia,Transportation / Logistics
PT Nylex Indonesia,Manufacturing/Production
PT Nynas Indonesia,Oil / Gas / Petroleum
PT Nyonya Meneer Semarang,Manufacturing/Production
PT Nyunyu Digital Media,Entertainment / Media
PT O.M. Indonesia,Others
PT O.Y.L. Sentra Manufacturing,Manufacturing/Production
PT Oaktech Nusantara,Electrical & Electronics
PT Oandgee Tehnik Indonesia,Construction/Building/Engineering
PT Oase Teknologi Asia,General & Wholesale Trading
PT Oasi Concept Indonesia,Manufacturing/Production
PT OASIS INTERNATIONAL,Others
PT Oasis Rhadana Hotel,Hotel/Hospitality
PT Oasis Water International (Bali),Manufacturing / Production
PT Oasis Waters International,Consumer Products/FMCG
PT Oasis Waters International,Food & Beverage/Catering/Restaurant
PT Oasis Waters International (Palembang),Manufacturing / Production
PT Oasis Waters International Semarang,General & Wholesale Trading
PT Oat Mitoku Agrio,Agricultural/Plantation/Poultry/Fisheries
PT Oazia Riverside,Hotel / Hospitality
PT OB Furni Interindo ( OB FIT ),Healthcare/Medical
PT Obagi Indonesia,Environment / Health / Safety
PT OBFA Indonesia,Construction/Building/Engineering
PT Obio Indo Energi,Mining
PT Obor Indonesia,Heavy Industrial/Machinery/Equipment
PT Obor Indonesia (Semarang),Heavy Industrial / Machinery / Equipment
PT Obor Kencana Kreasi Gemilang,Gems/Jewellery
PT Obor Sarana Utama,Printing/Publishing
PT OBS Citra Indonesia,Food & Beverage/Catering/Restaurant
PT OBSESI MASA DEPAN SUKSES,Exhibitions/Event management/MICE
PT OCBC Sekuritas Indonesia,Banking/Financial Services
PT Ocean Asia Pasific,Healthcare/Medical
PT Ocean Centra Furnindo,Manufacturing/Production
PT Ocean Champ Seafood,Agricultural/Plantation/Poultry/Fisheries
PT Ocean Global Shipping,Transportation / Logistics
PT Ocean Global Shipping Surabaya,Transportation / Logistics
PT Ocean Mitramas,Marine / Aquaculture
PT Ocean Network Express Indonesia,Transportation/Logistics
PT Ocean Paradise Fishery,Accounting/Audit/Tax Services
PT Ocean Realm Bali,Travel/Tourism
PT Ocean Trimitra Cemerlang,Travel/Tourism
PT Oceanco Semarang,Manufacturing/Production
PT OCEANIC GLOBAL INDONESIA,Marine/Aquaculture
PT Oceanic Trade & Services,General & Wholesale Trading
PT Oceanika Investindo (Ninety Nine Restaurant),Food & Beverage / Catering / Restaurant
PT Oceanindo Prima Sarana,Transportation/Logistics
PT Oceanwise Indonesia,Accounting/Audit/Tax Services
PT Ocellote Cendana Tri Artha,Retail/Merchandise
PT Ocentrum Indonesia,Advertising / Marketing / Promotion / PR
PT Oci Kaltim Melamin,Agricultural / Plantation / Poultry / Fisheries
PT Ock Ina Sukses,Food & Beverage/Catering/Restaurant
PT OCK Telecommunication,Telecommunication
PT OCS Indonesia (Offshore Crew Services),Others
PT Octa Mitranusa Persada,Manufacturing/Production
PT Octagon Karya Pratama,General & Wholesale Trading
PT Octovate Group Asia,Advertising/Marketing/Promotion/PR
PT Oculus Indonesia,Others
PT Oculus Studio,Architectural Services / Interior Designing
PT Ode Cipta Semesta,Manufacturing/Production
PT Odea Prima Global,Construction/Building/Engineering
PT Odele,Food & Beverage / Catering / Restaurant
PT Odeo Design House,Arts / Design / Fashion
PT ODG Indonesia,Construction/Building/Engineering
PT Odifa Jelajah Dunia,Travel / Tourism
PT Odira Energy Karang Agung,Oil/Gas/Petroleum
PT Odiseus International,Grooming / Beauty / Fitness
PT Odissey Shipping Lines,Marine/Aquaculture
PT ODITER INTERNATIONAL INDONESIA,Automobile/Automotive Ancillary/Vehicle
PT Odua Mitra Sarana,Property/Real Estate
PT Oemjih Tekno Indonesia,Telecommunication
PT Oenggul Pipa Inspeksitama,"Consulting (IT, Science, Engineering & Technical)"
PT OETAMA HUSADA PERMAI,Healthcare/Medical
PT Ofcos Konesia,Others
PT Office Box Indonesia,Architectural Services/Interior Designing
PT Office Planer Indonesia,"Consulting (IT, Science, Engineering & Technical)"
PT Offistarindo Adhiprima,General & Wholesale Trading
PT Offshore Hydraulics Indonesia,"Consulting (IT, Science, Engineering & Technical)"
PT Ogawa Indonesia,Consumer Products/FMCG
PT Ogawa Triguna,General & Wholesale Trading
PT OGWellness Technologies Indonesia,Healthcare/Medical
PT Ogya Tekno Nusantara,Computer/Information Technology (Software)
PT Ohaka Kencana,Automobile/Automotive Ancillary/Vehicle
PT Ohana Kreatif Eterna,Food & Beverage / Catering / Restaurant
PT Ohawe Indonesia,Healthcare/Medical
PT Ohayo Group Indonesia,Travel / Tourism
PT OHK Multi Prima Indonesia,Automobile/Automotive Ancillary/Vehicle
PT OHLALA International,Food & Beverage/Catering/Restaurant
PT Ohmcell Network Solutions Provider,Computer/Information Technology (Software)
PT Oilfield Crew Management Indonesia,Heavy Industrial/Machinery/Equipment
PT Oilfield Services & Supplies Indonesia,General & Wholesale Trading
PT Oilta Maju Bersama,Travel/Tourism
PT Oiltanking Merak,Oil/Gas/Petroleum
PT Oishi Machine Indonesia,General & Wholesale Trading
PT Oji Printech Indonesia,Manufacturing/Production
PT Okagawa Indonesia Trading,General & Wholesale Trading
PT Okamoto Indonesia,Manufacturing/Production
PT Okamoto Logistics Nusantara,Transportation / Logistics
PT Okansa Indonesia,General & Wholesale Trading
PT Okapito Teknologi Indonesia,Computer/Information Technology (Software)
