Perusahaan,Sektor
CV Mekar Agung Solutions,Accounting/Audit/Tax Services
CV Mekar Jaya Abadi,Wood / Fibre / Paper
CV Melati Organik Natura,Food & Beverage/Catering/Restaurant
CV Melsan,Healthcare / Medical
CV Menara Distribusi,Retail/Merchandise
CV Menara Putih,Architectural Services/Interior Designing
CV Mentari Prima Semarang,Manufacturing/Production
CV MERAH DELIMA CERIA,Others
CV Mercusuar Indonesia,Textiles/Garment
CV Merdeka Jaya Tehnik,Electrical & Electronics
CV Merpati Mas Sukses,General & Wholesale Trading
CV Merumas,Arts/Design/Fashion
CV Met Consult,Accounting/Audit/Tax Services
CV Metal Prima Mandiri,Manufacturing/Production
CV Metalindo Workshop Bogor,Manufacturing / Production
CV Metamorphz Technology Solutions Semarang,Computer / Information Technology (Software)
CV Metro Putera Prima,Others
CV Metro Tech Computer,Computer / Information Technology (Hardware)
CV Metta Offset,Printing/Publishing
CV Meyer Century,Healthcare/Medical
CV Miconos Transdata Nusantara,General & Wholesale Trading
CV Micro 2000,Construction / Building / Engineering
CV Micro Jaya Abadi,Heavy Industrial/Machinery/Equipment
CV Microindo Global Nusa,Manufacturing / Production
CV Mileindo Cipta Pratama,Architectural Services/Interior Designing
CV Millenium Auto Service,Automobile / Automotive Ancillary / Vehicle
CV Millennial Berjaya,General & Wholesale Trading
CV Mimba Jaya - Mimba Pool & Spa,Chemical/Fertilizers/Pesticides
CV Mimpi Manis,Consulting (Business & Management)
CV Mina Ceria Nusantara,Accounting/Audit/Tax Services
CV Mina Jadid,Retail / Merchandise
CV Mina Utama,Food & Beverage / Catering / Restaurant
CV Mindset Komunikasi Visual,Arts/Design/Fashion
CV Mindsound Technology,BioTechnology/Pharmaceutical/Clinical research
CV Minerva Auto Zone,Automobile / Automotive Ancillary / Vehicle
CV Mirage Indonesia,Computer/Information Technology (Hardware)
CV Mirai Production,Entertainment / Media
CV Mitra Abadi Sentosa,Transportation/Logistics
CV Mitra Abadi Solo,Retail / Merchandise
CV Mitra Anugerah Food,Food & Beverage / Catering / Restaurant
CV Mitra Arta Mandiri,Others
CV MITRA BANDUNG,General & Wholesale Trading
CV Mitra Bersama,Arts / Design / Fashion
CV Mitra Boga (Medan),Food & Beverage / Catering / Restaurant
CV Mitra Boga Selaras,Food & Beverage / Catering / Restaurant
CV Mitra Cipta Bersama,Grooming/Beauty/Fitness
CV Mitra Cipta Persada,Construction/Building/Engineering
CV Mitra Dinamis,Heavy Industrial / Machinery / Equipment
CV Mitra Dunia Palletindo,Wood / Fibre / Paper
CV MITRA DUNIA PALLETINDO,Wood/Fibre/Paper
CV MITRA DUNIA PALLETINDO (Semarang),Consulting (Business & Management)
CV Mitra Dunia Palletindo (Surabaya),Manufacturing/Production
CV Mitra Gamesindo,Others
CV Mitra Infotec Indonesia,Electrical & Electronics
CV Mitra Inti Top,Automobile / Automotive Ancillary / Vehicle
CV Mitra Jaya (Bekasi),Automobile / Automotive Ancillary / Vehicle
CV Mitra Jogjakarta,Retail/Merchandise
CV Mitra Kemenangan,General & Wholesale Trading
CV Mitra Kreasindo,Printing/Publishing
CV Mitra Krida Mandiri,Others
CV MITRA LEZAT LESTARI 1,Food & Beverage/Catering/Restaurant
CV Mitra Mobil Kita,Automobile / Automotive Ancillary / Vehicle
CV Mitra Modern (ASC Sony),Repair & Maintenance Services
CV Mitra Mulia,General & Wholesale Trading
CV Mitra Panen Abadi (EVERYDAY),Hotel/Hospitality
Cv Mitra Pratama,Others
CV Mitra Pratama Crenindo,Manufacturing / Production
CV Mitra Sahajaya,Manufacturing / Production
CV Mitra Sakti Motor,Automobile/Automotive Ancillary/Vehicle
CV Mitra Sarana,General & Wholesale Trading
CV Mitra Sejati,Retail / Merchandise
CV Mitra Sejati (Mobile Accessories),Retail/Merchandise
CV Mitra Sejati Distribusi,Consumer Products/FMCG
CV Mitra Sejati Distribusi (Tuban),Consumer Products/FMCG
CV Mitra Sejati Surabaya,Telecommunication
CV Mitra Setia Abadi,Retail / Merchandise
CV Mitra Solusi Abadi,Computer/Information Technology (Hardware)
CV MITRA SOLUSI INDUSTRI,Others
CV Mitra Solusi Mandiri (Bali),"Consulting (IT, Science, Engineering & Technical)"
CV Mitra Solusindo Computama,Retail / Merchandise
CV Mitra Sriwijaya,Retail/Merchandise
CV Mitra Sukses Kulit,General & Wholesale Trading
CV Mitra Synergy Global,Consulting (Business & Management)
CV Mitra Teknik (Surabaya),Computer / Information Technology (Software)
CV Mitra Tekno Pratama,Construction/Building/Engineering
CV Mitra Teknologi Informasi,Others
CV Mitra Usaha Mandiri,Retail / Merchandise
CV Mitra Utama Dental (Surabaya),Retail / Merchandise
CV Mitra Utama Niaga,Computer/Information Technology (Software)
CV Mitrafood Andalan Semesta,Transportation / Logistics
CV Mitrasindo Bangun Pratama,Accounting/Audit/Tax Services
CV MMB Koran JITU,Entertainment/Media
CV Mobil Auto Service,Automobile / Automotive Ancillary / Vehicle
CV Mobile Generation,Telecommunication
CV Moda Citra Kirana,Retail/Merchandise
CV MODE INDAH SUKSES,Textiles/Garment
CV Modern Gypsum,Architectural Services/Interior Designing
CV Modern Metal Industry,Heavy Industrial/Machinery/Equipment
CV Modern Plasindo Lestari,General & Wholesale Trading
CV Mogajaya Cemerlang,Textiles / Garment
