Perusahaan,Sektor
PT Artorius Telemetri Sentosa,"Consulting (IT, Science, Engineering & Technical)"
PT Artoss Jaya Bersama,Construction/Building/Engineering
PT Artrindo Bahana Sentosa (Bandung),Entertainment / Media
PT Artsenso Indonesia,Retail/Merchandise
PT ARTSOUNDLAB,Retail / Merchandise
PT Arttech Indonesia,Architectural Services / Interior Designing
PT ArtWire,Others
PT Artworkz Global Internasional,Arts/Design/Fashion
PT ARU Indonesia,Construction / Building / Engineering
PT Arudam Mas Jaya,Property/Real Estate
PT Arum CFM Indonesia,Others
PT Arum Mandiri Indonesia,Property/Real Estate
PT Arun Chaiseri Manajemen Indonesia,Others
PT Arun Prakarsa Inforindo,Consulting (Business & Management)
PT Aruna Daya Adiperkasa,Construction/Building/Engineering
PT Arus Tirta Niagatama,Environment/Health/Safety
PT Arutmin Indonesia,Mining
PT Aruza Prima Perkasa,Mining
PT Arvee Mega Realti,Advertising/Marketing/Promotion/PR
PT Arveo Pionir Mediatama,Entertainment/Media
PT Arvia Jaya,Automobile/Automotive Ancillary/Vehicle
PT Arvian,Food & Beverage/Catering/Restaurant
PT Arviapratama Tiara,Consumer Products/FMCG
PT Arvico Mitra Trading,General & Wholesale Trading
PT Arvinda Jaya Abadi,Food & Beverage/Catering/Restaurant
PT Arwana Citramulia Tbk,Manufacturing/Production
PT Arwana Mas Indonesia,General & Wholesale Trading
PT Arwinto Intan Wijaya (Darmo Trade Center),Construction/Building/Engineering
PT Arwuda Indonesia,Advertising / Marketing / Promotion / PR
PT Arya Bangun Cipta,Automobile / Automotive Ancillary / Vehicle
PT Arya Bhakti Ciptatehnik,Construction/Building/Engineering
PT Arya Dharma Putera,Grooming/Beauty/Fitness
PT ARYA GEMILANG ALMUBARAK,Manufacturing/Production
PT Arya Indomonodon,Agricultural / Plantation / Poultry / Fisheries
PT Arya Lingga Manik,Property / Real Estate
PT Arya Makmur Sejahtera,Food & Beverage/Catering/Restaurant
PT Arya Motor Indonesia,Automobile / Automotive Ancillary / Vehicle
PT Arya Rama Sentosa,Construction/Building/Engineering
PT Arya Sada Perkasa,Electrical & Electronics
PT Arya Sinergy Yadavas,Consulting (Business & Management)
PT Aryabumi Muliarama (ERA ARYA),Property / Real Estate
PT Aryaduta Karawaci Management,Hotel / Hospitality
PT Aryaguna Putra,Construction/Building/Engineering
PT Aryan Indonesia (Kidzania),Entertainment/Media
PT Aryan PP Properti,Entertainment/Media
PT ARYAN TECHNOLOGY SERVICES,General & Wholesale Trading
PT Aryana Cakasana,Construction/Building/Engineering
PT Aryaniaga Mitranusa,Consumer Products / FMCG
PT Aryasa Tekad Pratama,Healthcare / Medical
PT Aryasatya Makmur Lestari,Advertising/Marketing/Promotion/PR
PT Aryatama Banua Biru,Hotel/Hospitality
PT Aryatama Duta Cipta,"Consulting (IT, Science, Engineering & Technical)"
PT Aryateknik Makmursentosa,Heavy Industrial/Machinery/Equipment
PT Arybronusa Multydimensi,Construction / Building / Engineering
PT ARzap Studio Indonesia,Computer/Information Technology (Software)
PT Arzu Utama Realty,Property/Real Estate
PT Arzuro Kinerja Sumber Daya Manusia,Human Resources Management / Consulting
PT As Syirbani Mandiri Wisata,Travel/Tourism
PT Asa Bintang Pratama,Manufacturing/Production
PT Asa Cipta Semesta (ACSINDO),General & Wholesale Trading
PT ASA Foodnesia Abadi,Food & Beverage / Catering / Restaurant
PT ASA Forestry,Agricultural / Plantation / Poultry / Fisheries
PT Asa Hidup Indonesia,Banking/Financial Services
PT ASA Holiday,Travel / Tourism
PT ASA Indonesia,Accounting/Audit/Tax Services
PT ASA INDONESIANIS MANDIRI,Entertainment/Media
PT Asa Kaya Ide,Advertising / Marketing / Promotion / PR
PT Asa Mutiara Nusantara,Agricultural/Plantation/Poultry/Fisheries
PT Asa Pesona Malindo,Food & Beverage/Catering/Restaurant
PT Asa Tuai Sejahtera,Arts / Design / Fashion
PT Asaara Grha Archidea,Accounting/Audit/Tax Services
PT Asaba - Medan,General & Wholesale Trading
PT Asaba Computer Centre,Computer/Information Technology (Software)
PT Asada Mitra Packindo,Manufacturing/Production
PT Asahi Denso Indonesia,Automobile / Automotive Ancillary / Vehicle
PT Asahi Diamond Industrial Indonesia,Manufacturing/Production
PT Asahi Forge Indonesia,Manufacturing / Production
PT Asahi Indonesia,Manufacturing/Production
PT Asahi Solder Technology Indonesia,Electrical & Electronics
PT Asahimas Chemical,Chemical / Fertilizers / Pesticides
PT Asahimas Chemical (Banten),Chemical / Fertilizers / Pesticides
PT Asahimas Flat Glass Tbk,Manufacturing/Production
PT Asahimas Flat Glass Tbk. (Indoensia Career Expo),Manufacturing/Production
PT Asahindo Bayu Perdana,Manufacturing/Production
PT Asai Metal,Mining
PT Asalta Mandiri Agung,Manufacturing/Production
PT Asano Gear Indonesia,Automobile/Automotive Ancillary/Vehicle
PT Asaparis,Automobile/Automotive Ancillary/Vehicle
PT Asasia Mitra Utama,Human Resources Management/Consulting
PT Asata Utama Electrical Industries,Electrical & Electronics
PT Asaya Jaya Bersama Sejahtera,Retail / Merchandise
PT Ascendas Land indonesia,Property/Real Estate
PT Ascendo Internasional,Retail/Merchandise
PT ASCLAR Indonesia,Computer/Information Technology (Software)
PT Asco Media Utama,Automobile / Automotive Ancillary / Vehicle
PT Asco Prima Mobilindo,Automobile/Automotive Ancillary/Vehicle
PT Ascon Indonesia Internasional,Mining
PT Ascott International Management Indonesia,Hotel/Hospitality
PT Asdi Swasatya,General & Wholesale Trading
PT Asdovinti Mandiri,Human Resources Management / Consulting
