Perusahaan,Sektor
PT DAT Indonesia,Printing / Publishing
PT Data Bina Solusindo,Consulting (Business & Management)
PT Data Enerfy Infomedia,Computer/Information Technology (Software)
PT Data Enzim Cahaya Sintesa,Computer/Information Technology (Software)
PT Data Integra Dinamika,Manufacturing/Production
PT Data Investa Matra,Computer/Information Technology (Software)
PT Data Komunikasi Privasi,Telecommunication
PT Data Kreatif,Computer/Information Technology (Software)
PT Data Lintas Utama,Computer/Information Technology (Software)
PT Data Proteksindo,Computer / Information Technology (Software)
PT Data Raya Solusindo,Oil / Gas / Petroleum
PT Data Retail Solution,Computer / Information Technology (Hardware)
PT Data Soft International,General & Wholesale Trading
PT Data Tujuh Sinergi,"Consulting (IT, Science, Engineering & Technical)"
PT Data Utama Dinamika,Computer / Information Technology (Hardware)
PT DATA UTAMA INDONESIA,"Consulting (IT, Science, Engineering & Technical)"
PT Datacaraka Solusindo,Computer/Information Technology (Software)
PT Datacom Solusindo,Computer/Information Technology (Software)
PT Datacomindo Mitrausaha,General & Wholesale Trading
PT Datacomm Diangraha,Computer/Information Technology (Software)
PT Datacraft Indonesia,"Consulting (IT, Science, Engineering & Technical)"
PT Datadigi Indonesia,Computer/Information Technology (Software)
PT Dataglobal Komukatama,Computer/Information Technology (Hardware)
PT Dataindo Inti Swakarsa,Computer/Information Technology (Software)
PT Datakom Jaring Prima,Computer/Information Technology (Hardware)
PT Datalink Lintas Nusa,Construction/Building/Engineering
PT Datalink Manunggal,Telecommunication
PT Datamedia Infotama,Manufacturing/Production
PT DataNet Sistem Integrasi,"Consulting (IT, Science, Engineering & Technical)"
PT Datang Engineering Internasional,Construction/Building/Engineering
PT Datapati Tara Andika,Construction / Building / Engineering
PT Dataprima Graha Pratama,Human Resources Management / Consulting
PT Dataprima Sejahtera,Computer / Information Technology (Hardware)
PT Datareka Integrasia,Computer / Information Technology (Software)
PT Datascrip,Retail/Merchandise
PT Datatel Inter Nusa,Computer / Information Technology (Hardware)
PT Datatrenz Integrated Solution,Computer / Information Technology (Software)
PT Datavis Indonesia,Computer/Information Technology (Hardware)
PT Datindo Infonet Prima,Computer/Information Technology (Software)
PT Datra,General & Wholesale Trading
PT Datra Internusa,Construction / Building / Engineering
PT Datra Medical Service,Hotel / Hospitality
PT Datsun MIMOSA PUTRA ABADI,Others
PT Dattel Mitra Asia,Consulting (Business & Management)
PT Dattel Mitra Asia,Consulting (Business & Management)
PT Datum Global Mandiri,Architectural Services/Interior Designing
PT Datum Nawa Vista,Architectural Services/Interior Designing
PT Datumstruct Indonesia,"Consulting (IT, Science, Engineering & Technical)"
PT Datzo Investama Group,Property/Real Estate
PT Daun Biru Engineering,"Consulting (IT, Science, Engineering & Technical)"
PT Daun Cinta Bumi,Textiles/Garment
PT Daun Pandan Medika,Others
PT Dauni Natural Abadi,Grooming/Beauty/Fitness
PT Dauntama Intimas,Manufacturing / Production
PT Davari Anugerah Sejahtera,Agricultural/Plantation/Poultry/Fisheries
PT Davay Sejahtera Indonesia,Construction/Building/Engineering
PT Davian Sukses Gemilang,Computer/Information Technology (Software)
PT David Brown Putra Mas,General & Wholesale Trading
PT David Roy Indonesia,Food & Beverage/Catering/Restaurant
PT Davidi International,Manufacturing / Production
PT Davidson Jaya Sejahtera,Manufacturing / Production
PT Davinti Indonesia,Computer / Information Technology (Software)
PT Dawa Management,Hotel/Hospitality
PT Dawee Electronic Indonesia,Electrical & Electronics
PT Dawee Printing Indonesia,Printing/Publishing
PT Dawoo International,Polymer/Plastic/Rubber/Tyres
PT Daya Adicipta Medika,Healthcare/Medical
PT Daya Adicipta Motora,Automobile/Automotive Ancillary/Vehicle
PT Daya Adicipta Persada,Construction / Building / Engineering
PT Daya Adicipta Sandika,Automobile/Automotive Ancillary/Vehicle
PT Daya Adicipta Wihaya,Automobile/Automotive Ancillary/Vehicle
PT Daya Adicipta Wisesa,Automobile/Automotive Ancillary/Vehicle
PT Daya Aditya Gemilang,Textiles / Garment
PT DAYA AGUNG SINERGI,Food & Beverage/Catering/Restaurant
PT Daya Alvita Mandiri,Automobile/Automotive Ancillary/Vehicle
PT Daya Amani Solusimatika,"Consulting (IT, Science, Engineering & Technical)"
PT Daya Anugerah Mandiri (Cabang Jatinangor),Automobile / Automotive Ancillary / Vehicle
PT Daya Anugrah Mandiri,Automobile/Automotive Ancillary/Vehicle
PT Daya Anugrah Mandiri (Betung),Automobile / Automotive Ancillary / Vehicle
PT Daya Anugrah Mandiri (Lampung),Automobile / Automotive Ancillary / Vehicle
PT Daya Anugrah Pusaka,Manufacturing / Production
PT Daya Bahtera Sumatera,Transportation/Logistics
PT Daya Baru Agung,Manufacturing / Production
PT Daya Centra Indonesia,Architectural Services / Interior Designing
PT Daya Cipta Aksara,Entertainment / Media
PT Daya Cipta Andalan Persada,General & Wholesale Trading
PT Daya Cipta Karya Sempurna,Wood/Fibre/Paper
PT Daya Cipta Kemasindo,Manufacturing/Production
PT Daya Cipta Kontruksi,Construction / Building / Engineering
PT Daya Cipta Mandiri Solusi,Computer/Information Technology (Software)
PT Daya Cipta Optima,Consulting (Business & Management)
PT Daya Cipta Sarana,Automobile / Automotive Ancillary / Vehicle
PT Daya Cipta Seraya,Construction / Building / Engineering
PT Daya Dimensi Global Pte Ltd,General & Wholesale Trading
PT Daya Dimensi Indonesia ( HR Division ),Consulting (Business & Management)
PT Daya Eka Samudera Jakarta,Transportation/Logistics
PT Daya Energi Mandiri,Human Resources Management / Consulting
PT Daya Esa Mulya Mandiri,Manufacturing/Production
PT Daya Eximindo Perdana,Healthcare / Medical
PT Daya Indah Dinamika,Construction/Building/Engineering
