Perusahaan,Sektor
PT Harapan Insan Suksestama (Fastrackids) Surabaya,Education
PT Harapan Interaksi Swadaya,Manufacturing/Production
PT Harapan Inti Selaras,Banking / Financial Services
PT Harapan Jaya Intiutama,General & Wholesale Trading
PT Harapan Jaya Sentosa,Computer / Information Technology (Software)
PT Harapan Kasih,Others
PT Harapan Kemika Indo Lestari,General & Wholesale Trading
PT Harapan Maju Indah,General & Wholesale Trading
PT Harapan Mandiri Utama,Heavy Industrial/Machinery/Equipment
PT Harapan Marnov Agung,Retail / Merchandise
PT HARAPAN MULIA BERSAMA,Manufacturing/Production
PT Harapan Mulia Mandiri,Polymer / Plastic / Rubber / Tyres
PT Harapan Prima Printing,Printing/Publishing
PT Harapan Rahayu Citra (Hard Rock Cafe Bali),Food & Beverage/Catering/Restaurant
PT Harapan Riga Jordan,Education
PT Harapan Sembilan,Oil / Gas / Petroleum
PT Harapan Sri Jaya (Batam),Consulting (Business & Management)
PT Harapan Sukses Jaya (HSJ),Manufacturing/Production
PT Harapan Surya Lestari,Manufacturing/Production
PT Harapan Trans,Transportation/Logistics
PT Harapan Widyatama Pertiwi,Manufacturing/Production
PT Harapindo Jaya Sukses,Construction / Building / Engineering
PT Harba Primaperkasa,Construction / Building / Engineering
PT Harbarindo Baharitama,Manufacturing/Production
PT Harbison Walker International,Others
PT Harbison Walker International (Cilegon),Manufacturing/Production
PT Harda Esa Raksa,Human Resources Management/Consulting
PT Harda Mulia Perkasa,Consumer Products/FMCG
PT Harda Parama Sentosa,Architectural Services/Interior Designing
PT Hardeka Indah Utama,Apparel
PT Hardi Indraloka Nugraha,Government/Defence
PT Hardo Soloplast,Manufacturing/Production
PT Hardware (HW),Retail/Merchandise
PT HARDWARE CENTER INDONESIA,Retail / Merchandise
PT Hardy's Global Investindo,Property / Real Estate
PT Hardys Retailindo,Retail / Merchandise
PT Harfacindo Raya,Oil/Gas/Petroleum
PT HARFAM JAYA MAKMUR,Agricultural / Plantation / Poultry / Fisheries
PT Harfan Tri Megah (Edugate),Education
PT Harfit International,Manufacturing / Production
PT Hargas Industries Indonesia,Wood / Fibre / Paper
PT Hargen Nusantara,Heavy Industrial/Machinery/Equipment
PT Hari Hari Rejeki,Consumer Products/FMCG
PT Hari Mahardika Usaha,General & Wholesale Trading
PT Hari Sejahtera Abadi,Construction / Building / Engineering
PT Hari-hari Rezeki,Manufacturing / Production
PT Harian Tribun Medan,Entertainment/Media
PT Haribi Global Mandiri,Computer/Information Technology (Software)
PT Haribima Pandawa Putra,Advertising / Marketing / Promotion / PR
PT Haribima Pandawa Putra Media,Journalism
PT Haric Sentra Prima,Retail/Merchandise
PT Hariff Daya Tunggal Engineering,Computer/Information Technology (Hardware)
PT Hariff Power Services,Construction / Building / Engineering
PT Hariman Sukses Sejahtera,Construction/Building/Engineering
PT Harimau Power,Others
PT Harind Sarana Graha Utama,Architectural Services/Interior Designing
PT Harind Sarana Graha Utama (Bali),Manufacturing/Production
PT Harindo,Textiles / Garment
PT Harindo Toba Sejati,General & Wholesale Trading
PT Harindotama Mandiri,Textiles/Garment
PT Harindra Surya Sempurna,Manufacturing / Production
PT Hariso Indonesia,Computer/Information Technology (Software)
PT Harita Kencana Securities,Security / Law Enforcement
PT Harita Panca Mandiri Utama,Chemical / Fertilizers / Pesticides
PT Harita Prima Abadi Mineral,Mining
PT Harja Sukses Makmur,Human Resources Management / Consulting
PT Harjaguna Kurniamitra,Manufacturing/Production
PT HARJATAMA SENTOSA,General & Wholesale Trading
PT Harkat Sejahtera,Manufacturing/Production
PT Harli Dharma Kasih,Retail / Merchandise
PT Harlie Kreasi Pratama,Construction / Building / Engineering
PT Harmas Jalesveva,Property/Real Estate
PT Harmattan Indonesia ( 69SLAM ),Apparel
PT Harmedi Jaya Abadi (Jakarta),Food & Beverage/Catering/Restaurant
PT Harmoni Danatek Solusindo,Electrical & Electronics
PT Harmoni Dinamik Indonesia,Consumer Products/FMCG
PT Harmoni Graha Indah,Architectural Services/Interior Designing
PT Harmoni Jaya Sejahtera,Construction/Building/Engineering
PT Harmoni Karya Bersama,Accounting/Audit/Tax Services
PT Harmoni Lintas Gaya,Retail/Merchandise
PT Harmoni Maju Bersama,Tobacco
PT Harmoni Mas,Manufacturing/Production
PT Harmoni MitraJaya (Johnny Andrean Salon),Grooming / Beauty / Fitness
PT Harmoni Panca Utama,Mining
PT Harmoni Resources Management,Human Resources Management/Consulting
PT Harmoni Solusi Bisnis,"Consulting (IT, Science, Engineering & Technical)"
PT Harmonia Penta Estetika,Healthcare / Medical
PT HARMONIC PLASINDO JAYA,Polymer/Plastic/Rubber/Tyres
PT Harmony Mining,Mining
PT Harmony Tunas Prima,Apparel
PT Harnic Prakarsa Corpindo,General & Wholesale Trading
PT Harpa Sekawan,Automobile/Automotive Ancillary/Vehicle
PT Harpindo Jaya,Automobile / Automotive Ancillary / Vehicle
PT Harrisma Agung Jaya,Computer / Information Technology (Software)
PT Harrisma Buana Jaya,General & Wholesale Trading
PT Harrisma Informatika Jaya,Computer/Information Technology (Hardware)
PT Harrison & Gil-Java,Manufacturing/Production
PT Harsa Duta Mandiri,General & Wholesale Trading
PT Harsali Putra Perkasa,General & Wholesale Trading
PT Harsaya Niyarta,Advertising/Marketing/Promotion/PR
