Perusahaan,Sektor
PT Hi -Tech Ink Indonesia,Printing/Publishing
PT Hi Lex Indonesia,Heavy Industrial/Machinery/Equipment
PT Hi Net Shopping,Advertising/Marketing/Promotion/PR
PT Hi-Cook Indonesia,General & Wholesale Trading
PT Hi-Tech Ink Indonesia,Manufacturing/Production
PT Hiaptek Bersaudara,Textiles / Garment
PT Hiba Utama,Transportation/Logistics
PT Hibex Indonesia,Manufacturing/Production
PT Hidayah Insan Mulia,Education
PT Hidup Anugerah Rejeki,Human Resources Management / Consulting
PT Hidup Baru Cemerlang,Travel/Tourism
PT Hidup Baru Perdana Abadi,Electrical & Electronics
PT Hidup Baru Plasindo,Polymer/Plastic/Rubber/Tyres
PT Hidup Barutama Mandiri,Construction/Building/Engineering
PT Hidup Berkat Rahmat Anugerah,Healthcare/Medical
PT Hidup Makmur Terencana,Education
PT Hidup Mimpi,Entertainment / Media
PT Hidup Surya Kencana,Others
PT Hidupbaru Sukses Mandiri,Construction/Building/Engineering
PT Hidupmakmur Lestariabadi,Chemical/Fertilizers/Pesticides
PT Higashifuji Indonesia,Electrical & Electronics
PT Higen Jaya Karpet,Manufacturing/Production
PT High Side Indonesia,Grooming/Beauty/Fitness
PT High Speed Shipyard,Heavy Industrial/Machinery/Equipment
PT High Touch Indonesia,Manufacturing / Production
PT High Trading Indonesia (Surabaya),General & Wholesale Trading
PT Highend Technologies Indonesia,Manufacturing/Production
PT Higher Learning International,Education
PT Higienis Indonesia,Electrical & Electronics
PT Higo Adhesive Indonesia,Chemical / Fertilizers / Pesticides
PT Higo Fitur Indonesia,Computer / Information Technology (Software)
PT Hijau Agri Indonesia,Agricultural / Plantation / Poultry / Fisheries
PT Hijau Harmoni,Education
PT Hijau Indah Selaras,Exhibitions/Event management/MICE
PT Hijau Lingkungan Sawit Indah,Agricultural/Plantation/Poultry/Fisheries
PT Hijau Murni Alami,Food & Beverage/Catering/Restaurant
PT Hijrah Hanjaya,General & Wholesale Trading
PT Hikari Automation Indonesia,Heavy Industrial/Machinery/Equipment
PT Hikari Indo Sarana,Others
PT Hikari Panca Utama,Consulting (Business & Management)
PT Hikari Teknologi Toolsindo,Manufacturing/Production
PT Hikmah Bersama Sakti,Banking / Financial Services
PT Hikmah Bersama Sakti Cabang Bali,Human Resources Management / Consulting
PT Hikmah Sejahtera,Entertainment/Media
PT Hikmah Selayar Manunggal,Mining
PT Hikmat Fashion,Textiles/Garment
PT Hikmat Makna Aksara,Entertainment/Media
PT Hilab Sciencetama,"Consulting (IT, Science, Engineering & Technical)"
PT HILAL AMANAH QOLBU,Others
PT Hilbram Sentosa Jayaland,Property/Real Estate
PT Hilios Power,Others
PT Hiliran Gumanti,Retail / Merchandise
PT Hill Grove Indonesia,Mining
PT Hill Konsultan Indonesia,Security/Law Enforcement
PT Hillconjaya Sakti,General & Wholesale Trading
PT Hilon Felt (Cabang Salatiga),Textiles/Garment
PT Hilon Felt Cabang Semarang,Apparel
PT Hilon Indonesia,Manufacturing/Production
PT Hilon Indonesia (Bali),Manufacturing/Production
PT Hilon Indonesia Klaten,General & Wholesale Trading
PT Hilon Surabaya,Manufacturing/Production
PT Hilon Surabaya Cabang Makassar,Manufacturing/Production
PT Hilti Nusantara,Construction/Building/Engineering
PT Himalaya Citra Abadi,Architectural Services/Interior Designing
PT Himalaya Everest Jaya,Electrical & Electronics
PT HIMALAYA INDO KARYA,Computer/Information Technology (Software)
PT Himalaya Jaya Abadi,Manufacturing/Production
PT HIMALAYA JAYA surabaya,Transportation/Logistics
PT Himalaya Mitra Selaras,Manufacturing / Production
PT Himalaya Sinar Abadi,Construction/Building/Engineering
PT HIMAWAN CONSULTING GROUP,Consulting (Business & Management)
PT Himawari Lighting Indonesia,Electrical & Electronics
PT Himber Indonesia,Food & Beverage / Catering / Restaurant
PT Himel Indonesia,Manufacturing / Production
PT Hindo,Retail/Merchandise
PT Hindoli,Agricultural / Plantation / Poultry / Fisheries
PT Hino Finance Indonesia,Banking/Financial Services
PT Hino Motors Manufacturing Indonesia,Manufacturing/Production
PT Hino Motors Sales Indonesia,Retail/Merchandise
PT Hint Inti Tetra,Architectural Services/Interior Designing
PT Hip Lik Enterprises,Manufacturing/Production
PT Hiper Concrete Precast Structure Industry,Construction / Building / Engineering
PT Hipernet Indodata,"Consulting (IT, Science, Engineering & Technical)"
PT HIPRA INDONESIA,Healthcare/Medical
PT Hipwee Media Solutions,Entertainment/Media
PT Hira Express,Transportation / Logistics
PT Hira Radhika Kayana,Food & Beverage/Catering/Restaurant
PT Hirata Engineering Indonesia,"Consulting (IT, Science, Engineering & Technical)"
PT Hiro Sentra Global,"Consulting (IT, Science, Engineering & Technical)"
PT Hiro Technology Indocipta,Computer/Information Technology (Software)
PT Hirochiku Asia Indonesia,Heavy Industrial/Machinery/Equipment
PT Hiromindo Perkasa (Enceha Pacifik),General & Wholesale Trading
PT Hirose Electric Indonesia,Manufacturing/Production
PT HIROSE NUSANTARA INDONESIA,Construction/Building/Engineering
PT HIRUTA KOGYO INDONESIA,Automobile/Automotive Ancillary/Vehicle
PT Hisada Indonesia,Automobile / Automotive Ancillary / Vehicle
PT Hisamitsu Pharma Indonesia,BioTechnology / Pharmaceutical / Clinical research
PT Hisamitsu Pharma Indonesia,BioTechnology/Pharmaceutical/Clinical research
PT Hiseas International Indonesia,Travel/Tourism
PT Hisekamu Indonesia,Healthcare / Medical
