Perusahaan,Sektor
PT Jordan Beauty Products,BioTechnology/Pharmaceutical/Clinical research
PT Jordan Solusi Kreasindo,Advertising/Marketing/Promotion/PR
PT Jorindo Agung,Construction / Building / Engineering
PT Jorya Surya Mandiri,Arts / Design / Fashion
PT Josh & Tasani Lestari,Hotel / Hospitality
PT Joshie Arenco (branch Jkt),Architectural Services / Interior Designing
PT Joshie Arenco (Surabaya),Architectural Services/Interior Designing
PT Joshua Cahaya Sentosa,Architectural Services / Interior Designing
PT Joso,Architectural Services / Interior Designing
PT Jotam,Heavy Industrial/Machinery/Equipment
PT Jotem Prima Sejahtera,Manufacturing/Production
PT Jotun Indonesia,Manufacturing/Production
PT Joule Selera Nusantara,General & Wholesale Trading
PT Jova Kreasi Indonesia,Oil / Gas / Petroleum
PT Jovan Technologies,"Consulting (IT, Science, Engineering & Technical)"
PT Jovian System,Computer / Information Technology (Software)
PT Jowi Denta Medica Indonesia,Healthcare/Medical
PT Joy Berkat Utama,Travel/Tourism
PT JOY BUSINESS INTERNATIONAL,Advertising/Marketing/Promotion/PR
PT Joy Global Indonesia,Repair & Maintenance Services
PT Joy International,Textiles/Garment
PT Joy Shipping Agency Indonesia,Transportation/Logistics
PT Joya Hougan Lestari,Manufacturing/Production
PT Joyci Nusantara Cemerlang,Consumer Products / FMCG
PT Joypack Foods Indonesia,Accounting/Audit/Tax Services
PT JP Consult,Consulting (Business & Management)
PT JPC Indonesia,Electrical & Electronics
PT Jpindo Samudra Hutama,General & Wholesale Trading
PT JPOC Indonesia,Healthcare / Medical
PT JPPL Indonesia,Grooming/Beauty/Fitness
PT JPQ Indonesia,Manufacturing/Production
PT JS Utama,Manufacturing/Production
PT JSG International,Manufacturing/Production
PT JSW Plastics Machinery Indonesia,Heavy Industrial/Machinery/Equipment
PT JT Pratama Tour And Travel,Travel/Tourism
PT JTB Indonesia,Travel/Tourism
PT JTB Indonesia,Travel/Tourism
PT JTEKT Indonesia,Manufacturing/Production
PT JTNet Processing Indonesia,Computer/Information Technology (Software)
PT Jualio Digital Nusantara,Computer/Information Technology (Software)
PT Jualo,Retail/Merchandise
PT Juanda Saribundo,Food & Beverage/Catering/Restaurant
PT Juang Amirani,Advertising / Marketing / Promotion / PR
PT Juang Bara Utama,General & Wholesale Trading
PT Juang Jaya Abdi Alam,Agricultural / Plantation / Poultry / Fisheries
PT Juanto Mandiri Pratama,Retail / Merchandise
PT Juara,Manufacturing/Production
PT Juara Bike,Automobile/Automotive Ancillary/Vehicle
PT Juara Indonesia,Retail / Merchandise
PT Juara Teknik Sejahtera,Electrical & Electronics
PT Juara Teknik Sukses,Electrical & Electronics
PT Jubilee Powergen Envitec,General & Wholesale Trading
PT Juhdi Sakti Engeenering,"Consulting (IT, Science, Engineering & Technical)"
PT Jui FA International Foods,Manufacturing/Production
PT Jui Shin Indonesia,Manufacturing/Production
PT Jui Shin Indonesia (jakarta),Manufacturing/Production
PT Jui Shin Indonesia(Karawang),Manufacturing/Production
PT Juke Karunia Edutain,Entertainment/Media
PT Juke Solusi Teknologi,"Consulting (IT, Science, Engineering & Technical)"
PT Juken Technology Indonesia,Manufacturing / Production
PT Julo Teknologi Finansial,Banking/Financial Services
PT Julong Elektronika Teknologi,Electrical & Electronics
PT Juma Batu Palas,General & Wholesale Trading
PT JUMA BERLIAN EXIM,Transportation/Logistics
PT Juma Sejahtera Bersama,Food & Beverage/Catering/Restaurant
PT Jumai Trading Indonesia,General & Wholesale Trading
PT Jumaku Berjaya Sentosa (MEDAN),Retail/Merchandise
PT Jumbo Power International,Manufacturing/Production
PT Jumbo Power International Bali,Automobile/Automotive Ancillary/Vehicle
PT Jumbo Power International Balikpapan,General & Wholesale Trading
PT Jumbo Utama Selular,Telecommunication
PT Jump Distributors Indonesia,Transportation / Logistics
PT Jumway Group Indonesia,Property/Real Estate
PT Jun H Indonesia,Heavy Industrial/Machinery/Equipment
PT Jung Electric Indonesia,Electrical & Electronics
PT Jungleland Asia,Travel/Tourism
PT Juno Production,Arts / Design / Fashion
PT Jupiter Cantik Indonesia,Healthcare/Medical
PT Jupiter Mitra Setia,Construction / Building / Engineering
PT Jupiter Semesta Utama,Manufacturing / Production
PT Jurnal Consulting Indonesia,Computer/Information Technology (Software)
PT Jurnalindo Aksara Grafika (Bisnis Indonesia Bandung),Journalism
PT Jurnalindo Aksara Grafika (Bisnis Indonesia),Advertising / Marketing / Promotion / PR
PT Jurnalis Media Properti,Journalism
,
PT Jurukur Bahan Indonesia,Construction / Building / Engineering
PT Jusindo Sumber Prakarsa,Textiles/Garment
PT Just Shop Jaya (Daiso Japan),Consumer Products/FMCG
PT Justika Siar Publika,Consulting (Business & Management)
PT Jutarasa Abadi,Manufacturing/Production
PT Juvisk Tri Swarna,Construction/Building/Engineering
PT Juwita Collection,Food & Beverage/Catering/Restaurant
PT JVCKENWOOD Indonesia,Manufacturing/Production
PT K & I International Indonesia,Consumer Products / FMCG
PT K & I International Indonesia (Bandung),Wood/Fibre/Paper
PT K Line Logistics Indonesia,Transportation/Logistics
PT K Line Mobaru Diamond Indonesia,Transportation/Logistics
PT K LINE Mobaru Diamond Indonesia (Sidoarjo),Transportation / Logistics
PT K Smart Nusantara Technology Solution,Consumer Products / FMCG
PT K&D Electronics Indonesia,Polymer / Plastic / Rubber / Tyres
