Perusahaan,Sektor
PT KGL Indonesia,Transportation/Logistics
PT KGR Notebook,Electrical & Electronics
PT Khaima,Food & Beverage/Catering/Restaurant
PT Khalifa International Bussiness,Travel/Tourism
PT Khalifah Niaga Lantabura,General & Wholesale Trading
PT Khalifi Bersinar Djaya,General & Wholesale Trading
PT Khan Yoga Fit,Grooming/Beauty/Fitness
PT Khanza,Advertising / Marketing / Promotion / PR
PT Kharindo Prakarsa,Chemical/Fertilizers/Pesticides
PT Kharis Agung Putra Jaya,Grooming/Beauty/Fitness
PT Kharisma Adhitama Sejati,Construction/Building/Engineering
PT KHARISMA AGRO SWADAYA,Manufacturing/Production
PT Kharisma Aman Sentosa,Grooming/Beauty/Fitness
PT Kharisma Anugrah Jawara Abadi,Hotel/Hospitality
PT Kharisma Asset Management,Accounting / Audit / Tax Services
PT Kharisma Autokreasi Permai,Manufacturing/Production
PT Kharisma Bayu Kencana,Mining
PT Kharisma Bestari,Electrical & Electronics
PT Kharisma Citatunggal,Heavy Industrial / Machinery / Equipment
PT Kharisma Dahayu Sangkara,Grooming/Beauty/Fitness
PT Kharisma Damar Satya,Construction / Building / Engineering
PT Kharisma Dekorindo Indah,Arts/Design/Fashion
PT Kharisma Dewata Abadi,Chemical / Fertilizers / Pesticides
PT Kharisma Esa Unggul,Heavy Industrial/Machinery/Equipment
PT Kharisma Esa Unggul Cabang Medan,Heavy Industrial/Machinery/Equipment
PT Kharisma Export Yogyakarta,Manufacturing / Production
PT Kharisma Global Solusindo,"Consulting (IT, Science, Engineering & Technical)"
PT Kharisma Gunamakmur,Construction/Building/Engineering
PT Kharisma Harapan Luhur,General & Wholesale Trading
PT Kharisma Indonesia,Manufacturing/Production
PT Kharisma Interplast Pratama,Polymer / Plastic / Rubber / Tyres
PT Kharisma Inti Serasi (Nasa Hotel Banjarmasin),Hotel / Hospitality
PT Kharisma Jawara Abadi,Accounting/Audit/Tax Services
PT Kharisma Jaya Nusantara,Telecommunication
PT Kharisma Kemingking,Agricultural / Plantation / Poultry / Fisheries
PT Kharisma Klasik Indonesia,Manufacturing/Production
PT Kharisma Kreasi Sehati,Architectural Services / Interior Designing
PT Kharisma Mataram Jaya Gemilang,Automobile/Automotive Ancillary/Vehicle
PT Kharisma Medika Indonesia,Healthcare/Medical
PT Kharisma Mitra Lestari,Manufacturing / Production
PT Kharisma Mitra Sejahtera,Food & Beverage/Catering/Restaurant
PT Kharisma Mutiara Agung,Transportation/Logistics
PT Kharisma Pakmu Mandiri,Manufacturing / Production
PT Kharisma Pasific Jaya,General & Wholesale Trading
PT Kharisma Pemasaran Bersama Nusantara,Agricultural/Plantation/Poultry/Fisheries
PT Kharisma Perkasa Dewata,Automobile / Automotive Ancillary / Vehicle
PT Kharisma Persada Mandiri (Bali),Telecommunication
PT Kharisma Potensia Indonesia,Human Resources Management/Consulting
PT Kharisma Propertindo,Property / Real Estate
PT Kharisma Putra Jaya,General & Wholesale Trading
PT KHARISMA PUTRA SEJAHTERA,Retail/Merchandise
PT Kharisma Sarana Jaya,Hotel / Hospitality
PT Kharisma Sejahtera - Surabaya,Automobile/Automotive Ancillary/Vehicle
PT Kharisma Sentosa (Bali),Automobile/Automotive Ancillary/Vehicle
PT Kharisma Sentosa Pucang (Surabaya),Automobile / Automotive Ancillary / Vehicle
PT Kharisma Suma Jaya Sakti,Automobile / Automotive Ancillary / Vehicle
PT Kharisma Ukhuwwah Mandiri,Others
PT Kharisma Utama Sentosa,Transportation/Logistics
PT Kharismapratama Abadisejatindo,General & Wholesale Trading
PT Kharismapratama Abadisejatindo,Heavy Industrial/Machinery/Equipment
PT Kharissa Tour and Travel Sidoarjo,Travel / Tourism
PT Kharistama Inti Manunggal,Accounting/Audit/Tax Services
PT Khasanah Jaya Mandiri,Travel / Tourism
PT Khasanah Putera Jakarta Medica (RS Medika BSD),Hotel/Hospitality
PT Khasanah Timur Indonesia(Medan),Manufacturing/Production
pt khasanah ukhuwah bertiga,Others
PT Khassana Solusi,Accounting/Audit/Tax Services
PT Khatah Artha,General & Wholesale Trading
PT Khatulistiwa Jaya Sinergi,Transportation / Logistics
PT Khatulistiwa Press,Entertainment / Media
PT Khatulistiwa Suryanusa,Automobile/Automotive Ancillary/Vehicle
PT Khazanah Lintas Persada,Computer / Information Technology (Software)
PT Khazanah Mitra Sinergi,Consulting (Business & Management)
PT Khidmat Perawatan Jasa Medika,Healthcare / Medical
PT Khong Guan Biscuit,Consumer Products/FMCG
PT KHOULAH PRIMA RAYA,Property/Real Estate
PT Khrisna Duta International,Transportation/Logistics
PT Khrisna Group,Others
PT Khrisna Inter Visi Media,Advertising/Marketing/Promotion/PR
PT Khrista Dasetra,General & Wholesale Trading
PT Ki-Antaka Rasa,Manufacturing/Production
PT KIA Mobil Indonesia (Pekanbaru),Automobile / Automotive Ancillary / Vehicle
PT KIA Mobil Indonesia (Semarang),Automobile/Automotive Ancillary/Vehicle
PT KIA Mobil Indonesia (Sunter Garden),Automobile/Automotive Ancillary/Vehicle
PT KIA Mobil Indonesia (Surabaya),Automobile/Automotive Ancillary/Vehicle
PT Kian Aji Hutama,Architectural Services / Interior Designing
PT Kian Bangun Radiza,Chemical / Fertilizers / Pesticides
PT Kian Mulia Manunggal,General & Wholesale Trading
PT Kian Olympic Indonesia,Construction/Building/Engineering
PT Kianis Pratama,Environment/Health/Safety
PT Kiat Global Batam Sukses,Consulting (Business & Management)
PT Kiat Global Ismatika,Government / Defence
PT Kiat Sukses Makmur,Manufacturing/Production
PT Kiattama Mandiri,Retail/Merchandise
PT Kiblat Pengusaha Indonesia,Printing/Publishing
PT Kibo Trading,Others
PT Kichi Arziki Industri,BioTechnology/Pharmaceutical/Clinical research
PT Kidang Gesit Perkasa,Agricultural / Plantation / Poultry / Fisheries
PT Kiddycuts Pratama Indonesia,Grooming/Beauty/Fitness
PT Kideco Jaya Agung (Kideco),Mining
