Perusahaan,Sektor
PT Miracle Harapan Indonesia,Healthcare/Medical
PT Mirae Asset Sekuritas,Banking/Financial Services
PT Mirah Bali Konstruksi,Construction/Building/Engineering
PT Mirah Segar,Hotel/Hospitality
PT Mirajaya Persada,Manufacturing / Production
PT Miranti Adhi Persada,Construction / Building / Engineering
PT Mire Korsindo,Architectural Services/Interior Designing
PT Mirinda Cipta Plastindo,Polymer/Plastic/Rubber/Tyres
PT Mirota craft centre,Retail / Merchandise
PT Mirota KSM,Manufacturing/Production
PT Mirota Nayan,Retail/Merchandise
PT Mirwan Suwarso Partners,"Consulting (IT, Science, Engineering & Technical)"
PT Misete Solusi Teknologi,Computer/Information Technology (Software)
PT Misi Sehat Imani,Healthcare/Medical
PT Miski Global Mandiri,Food & Beverage / Catering / Restaurant
PT MISS ROSE INDONESIA,Grooming/Beauty/Fitness
PT Missi Idea Selaras,Advertising/Marketing/Promotion/PR
PT Mistala Indonesia,Computer/Information Technology (Software)
PT Misuco Elektronik,Computer / Information Technology (Software)
PT Misumi Indonesia,General & Wholesale Trading
PT Miswak Utama (Siwak Tooth Paste),Manufacturing / Production
PT Mitachi Indonesia,General & Wholesale Trading
PT Mitaka Indonesia,Textiles / Garment
PT Mitekindo,Construction/Building/Engineering
PT Mitha Madyasari,Travel/Tourism
PT Mitha Madyasari (Bali Shalom),Grooming / Beauty / Fitness
PT Mithaharum Abadi,Computer / Information Technology (Software)
PT Mitindo Global Jaya,Others
PT Mitindo Usahasejati (Mitindo Foods),Food & Beverage / Catering / Restaurant
PT Mitochi Pratama Indonesia,Electrical & Electronics
PT Mitora Consulting,Consulting (Business & Management)
PT Mitra (Surabaya),Human Resources Management / Consulting
PT MITRA ABADI AUTOPARTS,Automobile/Automotive Ancillary/Vehicle
PT Mitra Abadi Bersama,Electrical & Electronics
PT Mitra Abadi Buana,Construction/Building/Engineering
PT MITRA ABADI INTERNASIONAL,Architectural Services/Interior Designing
PT MITRA ABADI LINTAS GENERASI,Construction/Building/Engineering
pt mitra abadi santosa,General & Wholesale Trading
PT Mitra Abadi Sejahtera Boxindo,Manufacturing/Production
PT Mitra Abadi Sentosa Raya,Healthcare / Medical
PT Mitra AbadiJaya Engineering,General & Wholesale Trading
PT Mitra Abadijaya Sukses,General & Wholesale Trading
PT Mitra Adikarya Sejahtera,Construction / Building / Engineering
PT Mitra Adikarya Sentosa,Construction / Building / Engineering
PT Mitra Adiperkasa Tbk,Retail/Merchandise
PT Mitra Adiperkasa Tbk (MAP Fashion1),Retail/Merchandise
PT Mitra Adipratama Sejati Finance,Banking/Financial Services
PT Mitra Adira Utama,Transportation/Logistics
PT Mitra Agung Indonesia,Construction/Building/Engineering
PT Mitra Agung Sejati,Chemical/Fertilizers/Pesticides
PT Mitra Agung Tekindo,Telecommunication
PT Mitra Alam Persada,Mining
PT Mitra Alam Sinar Sejahtera,Manufacturing / Production
PT Mitra Amanah,Consulting (Business & Management)
PT Mitra Amanda,Polymer/Plastic/Rubber/Tyres
PT Mitra Ambrosia Pratama,Healthcare/Medical
PT Mitra Amertha Sejahtera,Electrical & Electronics
PT Mitra Andal Sejati,Consumer Products/FMCG
PT Mitra Andal Sejati (Bali),Human Resources Management / Consulting
PT Mitra Andalan Batam,General & Wholesale Trading
PT MITRA ANDALAN LESTARI,Manufacturing/Production
PT Mitra Andalan Nasional,Retail / Merchandise
PT Mitra Andalan Sejati Solusindo,Computer / Information Technology (Software)
PT Mitra Anugrah Pratama Sejahtera,Food & Beverage/Catering/Restaurant
PT Mitra Arkitura Indonesia,Construction / Building / Engineering
PT Mitra Armada Sejahtera,Retail / Merchandise
PT Mitra Artha Laksmana,Property/Real Estate
PT Mitra Arung Buana,General & Wholesale Trading
PT Mitra Asa Pratama,Healthcare/Medical
PT Mitra Asia Cemerlang,Mining
PT Mitra Asia Synergy,General & Wholesale Trading
PT Mitra Asmoco Utama,Oil/Gas/Petroleum
PT Mitra Atedaselaras,Construction/Building/Engineering
PT Mitra Auto Mobiloka,Accounting/Audit/Tax Services
PT Mitra Aviasi Perkasa,Aerospace/Aviation/Airline
PT MITRA BAHAGIA NIPPINDO,Computer/Information Technology (Software)
PT Mitra Bahana Engineeringg,"Consulting (IT, Science, Engineering & Technical)"
PT Mitra Baja Safetindo,General & Wholesale Trading
PT Mitra Baja Sukses,Manufacturing/Production
PT Mitra Bakti UT,Accounting/Audit/Tax Services
PT Mitra Bangun Abadi,Manufacturing / Production
PT MITRA BANGUN BERSAMA JAYA,"Consulting (IT, Science, Engineering & Technical)"
PT Mitra Bangun Graha,General & Wholesale Trading
PT Mitra Banten Multimedia,Entertainment/Media
PT Mitra Belanja Perkasa,Retail / Merchandise
PT Mitra Bening Lestari,Construction/Building/Engineering
PT Mitra Berjaya Coffee,Food & Beverage / Catering / Restaurant
PT Mitra Berkat Abadi,Consulting (Business & Management)
PT Mitra Berkat Lestari,Automobile / Automotive Ancillary / Vehicle
PT Mitra Berkat Wisata,Travel/Tourism
PT Mitra Bersama Jaya,General & Wholesale Trading
PT Mitra Bersaudara Sejaya,Accounting/Audit/Tax Services
PT Mitra Bina Talenta,Consulting (Business & Management)
PT Mitra Binamandiri Makmur,Others
PT Mitra Bisnis Keluarga Ventura,Banking/Financial Services
PT Mitra Bisnis Teknologi Indonesia,Computer/Information Technology (Software)
PT Mitra Boga Kencana,Food & Beverage/Catering/Restaurant
PT Mitra Boga Nusantara (Cheese & Caviar),Others
PT Mitra Boga Panigoran,Food & Beverage/Catering/Restaurant
PT Mitra Boga Perdana,Food & Beverage/Catering/Restaurant
